qID,qText,qSpan,speaker,addressee,qType,refExp,menTexts,menSpans,menEnts,speakerGender,dialogueTurn,speakerType,novel,startParaID,endParaID,startChapID,endChapID,speakerID,startByte,endByte
Q0-0,"I suppose you would like to take them to the Casino to play roulette? Well, excuse my speaking so plainly, but I know how addicted you are to gambling. Though I am not your mentor, nor wish to be, at least I have a right to require that you shall not actually _compromise_ me.","[2309, 2585]",The General,['Alexis Ivanovitch'],Anaphoric,he added,"['you', 'you', 'your', 'you']","[[2319, 2322], [2440, 2443], [2477, 2481], [2546, 2549]]","[['Alexis Ivanovitch'], ['Alexis Ivanovitch'], ['Alexis Ivanovitch'], ['Alexis Ivanovitch']]",X,0,major,TheGambler,7,7,1,1,16,2309,2585
Q1-0,"I have no money for gambling,","[2589, 2618]",Alexis Ivanovitch,['The General'],Anaphoric,I quietly replied,[],[],[],X,1,major,TheGambler,8,8,1,1,4,2589,2618
Q2-0,"But you will soon be in receipt of some,","[2641, 2681]",The General,['Alexis Ivanovitch'],Explicit,retorted the General,['you'],"[[2645, 2648]]",[['Alexis Ivanovitch']],X,2,major,TheGambler,9,9,1,1,16,2641,2681
Q3-0,"Let us calculate,","[2865, 2882]",The General,['Alexis Ivanovitch'],Anaphoric,he went on,['us'],"[[2869, 2871]]","[['The General', 'Alexis Ivanovitch']]",X,3,major,TheGambler,10,10,1,1,16,2865,2882
Q3-1,"We must translate these roubles into thalers. Here take 100 thalers, as a round sum. The rest will be safe in my hands.","[2897, 3016]",The General,['Alexis Ivanovitch'],Anaphoric,he went on,['We'],"[[2897, 2899]]","[['The General', 'Alexis Ivanovitch']]",X,3,major,TheGambler,10,10,1,1,16,2897,3016
Q4-0,"You must not be offended at what I say,","[3050, 3089]",The General,['Alexis Ivanovitch'],Anaphoric,he continued,['You'],"[[3050, 3053]]",[['Alexis Ivanovitch']],X,4,major,TheGambler,12,12,1,1,16,3050,3089
Q4-1,You are too touchy about these things. What I have said I have said merely as a warning. To do so is no more than my right.,"[3106, 3229]",The General,['Alexis Ivanovitch'],Anaphoric,he continued,['You'],"[[3106, 3109]]",[['Alexis Ivanovitch']],X,4,major,TheGambler,12,12,1,1,16,3106,3229
Q5-0,"_Why_ do I continue to dance attendance upon the General, instead of having left him and his family long ago?","[6481, 6590]",Alexis Ivanovitch,['Alexis Ivanovitch'],Anaphoric,I had asked myself,"['General', 'him', 'his']","[[6530, 6537], [6562, 6565], [6570, 6573]]","[['The General'], ['The General'], ['The General']]",X,5,major,TheGambler,17,17,1,1,4,6481,6590
Q6-0,"If one is a man of self-respect,","[7226, 7258]",Alexis Ivanovitch,"['The General', 'Marqis De Griers', 'Mr. Astley']",Anaphoric,I went on,[],[],[],X,6,major,TheGambler,19,19,1,1,4,7226,7258
Q6-1,"one risks abuse by so doing, and is forced to put up with insults of every kind. Both at Paris and on the Rhine, and even in Switzerland there are so many Poles, with their sympathisers, the French, at these tables d h te that one cannot get a word in edgeways if one happens only to be a Russian.","[7272, 7569]",Alexis Ivanovitch,"['The General', 'Marqis De Griers', 'Mr. Astley']",Anaphoric,I went on,[],[],[],X,6,major,TheGambler,19,19,1,1,4,7272,7569
Q7-0,"Of course, one always learns _something everywhere_,","[7733, 7785]",Marqis De Griers,"['The General', 'Mr. Astley', 'Alexis Ivanovitch']",Anaphoric,said the Frenchman,[],[],[],X,7,minor,TheGambler,21,21,1,1,8,7733,7785
Q8-0,"In Paris, too, I had a dispute with a Pole,","[7850, 7893]",Alexis Ivanovitch,"['The General', 'Marqis De Griers', 'Mr. Astley']",Anaphoric,I continued,[],[],[],X,8,major,TheGambler,22,22,1,1,4,7850,7893
Q8-1,and then with a French officer who supported him. After that a section of the Frenchmen present took my part. They did so as soon as I told them the story of how once I threatened to spit into Monsignor s coffee.,"[7909, 8121]",Alexis Ivanovitch,"['The General', 'Marqis De Griers', 'Mr. Astley']",Anaphoric,I continued,[],[],[],X,8,major,TheGambler,22,22,1,1,4,7909,8121
Q9-0,To spit into it?,"[8125, 8141]",The General,"['Marqis De Griers', 'Mr. Astley', 'Alexis Ivanovitch']",Explicit,the General inquired,[],[],[],X,9,major,TheGambler,23,23,1,1,16,8125,8141
Q10-0,"Just so,","[8280, 8288]",Alexis Ivanovitch,"['The General', 'Marqis De Griers', 'Mr. Astley']",Anaphoric,I replied,[],[],[],X,10,major,TheGambler,24,24,1,1,4,8280,8288
Q10-1,"You must know that, on one occasion, when, for two days, I had felt certain that at any moment I might have to depart for Rome on business, I repaired to the Embassy of the Holy See in Paris, to have my passport visaed. There I encountered a sacristan of about fifty, and a man dry and cold of mien. After listening politely, but with great reserve, to my account of myself, this sacristan asked me to wait a little. I was in a great hurry to depart, but of course I sat down, pulled out a copy of _L Opinion Nationale_, and fell to reading an extraordinary piece of invective against Russia which it happened to contain. As I was thus engaged I heard some one enter an adjoining room and ask for Monsignor; after which I saw the sacristan make a low bow to the visitor, and then another bow as the visitor took his leave. I ventured to remind the good man of my own business also; whereupon, with an expression of, if anything, increased dryness, he again asked me to wait. Soon a third visitor arrived who, like myself, had come on business (he was an Austrian of some sort); and as soon as ever he had stated his errand he was conducted upstairs! This made me very angry. I rose, approached the sacristan, and told him that, since Monsignor was receiving callers, his lordship might just as well finish off my affair as well. Upon this the sacristan shrunk back in astonishment. It simply passed his understanding that any insignificant Russian should dare to compare himself with other visitors of Monsignor s! In a tone of the utmost effrontery, as though he were delighted to have a chance of insulting me, he looked me up and down, and then said: ","[8302, 9956]",Alexis Ivanovitch,"['The General', 'Marqis De Griers', 'Mr. Astley']",Anaphoric,I replied,['You'],"[[8302, 8305]]",[['The General']],X,10,major,TheGambler,24,24,1,1,4,8302,9956
Q10-2, But I only cried the louder: ,"[10031, 10061]",Alexis Ivanovitch,"['The General', 'Marqis De Griers', 'Mr. Astley']",Anaphoric,I replied,[],[],[],X,10,major,TheGambler,24,24,1,1,4,10031,10061
Q10-3,"screeched the sacristan, again shrinking back in horror. Then, rushing to the door, he spread out his arms as though he would rather die than let me enter.","[10275, 10430]",Alexis Ivanovitch,"['The General', 'Marqis De Griers', 'Mr. Astley']",Anaphoric,I replied,[],[],[],X,10,major,TheGambler,25,25,1,1,4,10275,10430
Q11-0,But ,"[10960, 10964]",The General,"['Marqis De Griers', 'Mr. Astley', 'Alexis Ivanovitch']",Explicit,the General began,[],[],[],X,11,major,TheGambler,27,27,1,1,16,10960,10964
Q12-0,"What really saved you was the fact that you proclaimed yourself a heretic and a barbarian,","[10987, 11077]",Marqis De Griers,"['The General', 'Mr. Astley', 'Alexis Ivanovitch']",Anaphoric,remarked the Frenchman,"['you', 'you']","[[11005, 11008], [11027, 11030]]","[['Alexis Ivanovitch'], ['Alexis Ivanovitch']]",X,12,minor,TheGambler,28,28,1,1,8,10987,11077
Q12-1,Cela n  tait pas si b te.,"[11117, 11142]",Marqis De Griers,"['The General', 'Mr. Astley', 'Alexis Ivanovitch']",Anaphoric,remarked the Frenchman,[],[],[],X,12,minor,TheGambler,28,28,1,1,8,11117,11142
Q13-0,"But is _that_ how Russian subjects ought to be treated? Why, when they settle here they dare not utter even a word they are ready even to deny the fact that they are Russians! At all events, at my hotel in Paris I received far more attention from the company after I had told them about the fracas with the sacristan. A fat Polish nobleman, who had been the most offensive of all who were present at the table d h te, at once went upstairs, while some of the Frenchmen were simply disgusted when I told them that two years ago I had encountered a man at whom, in 1812, a French  hero  fired for the mere fun of discharging his musket. That man was then a boy of ten and his family are still residing in Moscow.","[11146, 11856]",Alexis Ivanovitch,"['The General', 'Marqis De Griers', 'Mr. Astley']",Implicit,,[],[],[],X,13,major,TheGambler,29,29,1,1,4,11146,11856
Q14-0,Impossible!,"[11860, 11871]",Marqis De Griers,"['The General', 'Mr. Astley', 'Alexis Ivanovitch']",Anaphoric,the Frenchman spluttered,[],[],[],X,14,minor,TheGambler,30,30,1,1,8,11860,11871
Q14-1,No French soldier would fire at a child!,"[11900, 11940]",Marqis De Griers,"['The General', 'Mr. Astley', 'Alexis Ivanovitch']",Anaphoric,the Frenchman spluttered,[],[],[],X,14,minor,TheGambler,30,30,1,1,8,11900,11940
Q15-0,"Nevertheless the incident was as I say,","[11944, 11983]",Alexis Ivanovitch,"['The General', 'Marqis De Griers', 'Mr. Astley']",Anaphoric,I replied,[],[],[],X,15,major,TheGambler,31,31,1,1,4,11944,11983
Q15-1,"A very respected ex-captain told me the story, and I myself could see the scar left on his cheek.","[11997, 12094]",Alexis Ivanovitch,"['The General', 'Marqis De Griers', 'Mr. Astley']",Anaphoric,I replied,[],[],[],X,15,major,TheGambler,31,31,1,1,4,11997,12094
Q16-0,"Come what may, I _must_ have money,","[13357, 13392]",Polina Alexandrovna,['Alexis Ivanovitch'],Anaphoric,she said,[],[],[],X,16,major,TheGambler,34,34,1,1,12,13357,13392
Q16-1,And get it somehow I will otherwise I shall be ruined.,"[13405, 13459]",Polina Alexandrovna,['Alexis Ivanovitch'],Anaphoric,she said,[],[],[],X,16,major,TheGambler,34,34,1,1,12,13405,13459
Q17-0,"Nothing; except that two pieces of news have reached us from St. Petersburg. In the first place, my grandmother is very ill, and unlikely to last another couple of days. We had this from Timothy Petrovitch himself, and he is a reliable person. Every moment we are expecting to receive news of the end.","[13513, 13814]",Polina Alexandrovna,['Alexis Ivanovitch'],Implicit,,"['us', 'We', 'we']","[[13566, 13568], [13683, 13685], [13770, 13772]]","[['Polina Alexandrovna'], ['Polina Alexandrovna'], ['Polina Alexandrovna']]",X,17,major,TheGambler,36,36,1,1,12,13513,13814
Q18-0,All of you are on the tiptoe of expectation?,"[13818, 13862]",Alexis Ivanovitch,['Polina Alexandrovna'],Anaphoric,I queried,['you'],"[[13825, 13828]]",[['Polina Alexandrovna']],X,18,major,TheGambler,37,37,1,1,4,13818,13862
Q19-0,"Of course all of us, and every minute of the day. For a year-and-a-half now we have been looking for this.","[13877, 13983]",Polina Alexandrovna,['Alexis Ivanovitch'],Implicit,,"['us', 'we']","[[13894, 13896], [13953, 13955]]","[['Polina Alexandrovna'], ['Polina Alexandrovna']]",X,19,major,TheGambler,38,38,1,1,12,13877,13983
Q20-0,Looking for it?,"[13987, 14002]",Alexis Ivanovitch,['Polina Alexandrovna'],Implicit,,[],[],[],X,20,major,TheGambler,39,39,1,1,4,13987,14002
Q21-0,"Yes, looking for it. I am not her blood relation, you know I am merely the General s step-daughter. Yet I am certain that the old lady has remembered me in her will.","[14006, 14171]",Polina Alexandrovna,['Alexis Ivanovitch'],Implicit,,['the General'],"[[14077, 14088]]",[['The General']],X,21,major,TheGambler,40,40,1,1,12,14006,14171
Q22-0,"Yes, I believe that you _will_ come in for a good deal,","[14175, 14230]",Alexis Ivanovitch,['Polina Alexandrovna'],Anaphoric,I said,['you'],"[[14195, 14198]]",[['Polina Alexandrovna']],X,22,major,TheGambler,41,41,1,1,4,14175,14230
Q23-0,"Yes, for she is fond of me. But how come you to think so?","[14262, 14319]",Polina Alexandrovna,['Alexis Ivanovitch'],Implicit,,['you'],"[[14303, 14306]]",[['Alexis Ivanovitch']],X,23,major,TheGambler,42,42,1,1,12,14262,14319
Q24-0,"That Marquis of yours,","[14366, 14388]",Alexis Ivanovitch,['Polina Alexandrovna'],Anaphoric,I said,"['That Marquis', 'yours']","[[14366, 14378], [14382, 14387]]","[['Marqis De Griers'], ['Polina Alexandrovna']]",X,24,major,TheGambler,43,43,1,1,4,14366,14388
Q24-1, is _he_ also familiar with your family secrets?,"[14399, 14447]",Alexis Ivanovitch,['Polina Alexandrovna'],Anaphoric,I said,"['he', 'your ']","[[14404, 14406], [14427, 14432]]","[['Marqis De Griers'], ['Polina Alexandrovna']]",X,24,major,TheGambler,43,43,1,1,4,14399,14447
Q25-0,And why are you yourself so interested in them?,"[14451, 14498]",Polina Alexandrovna,['Alexis Ivanovitch'],Anaphoric,was her retort,['you'],"[[14463, 14466]]",[['Alexis Ivanovitch']],X,25,major,TheGambler,44,44,1,1,12,14451,14498
Q26-0,"Never mind. If I am not mistaken, the General has succeeded in borrowing money of the Marquis.","[14551, 14645]",Alexis Ivanovitch,['Polina Alexandrovna'],Implicit,,"['the General', 'the Marquis']","[[14585, 14596], [14633, 14644]]","[['The General'], ['Marqis De Griers']]",X,26,major,TheGambler,45,45,1,1,4,14551,14645
Q27-0,It may be so.,"[14649, 14662]",Polina Alexandrovna,['Alexis Ivanovitch'],Implicit,,[],[],[],X,27,major,TheGambler,46,46,1,1,12,14649,14662
Q28-0,"Is it likely that the Marquis would have lent the money if he had not known something or other about your grandmother? Did you notice, too, that three times during luncheon, when speaking of her, he called her  La Baboulenka ?","[14666, 14892]",Alexis Ivanovitch,['Polina Alexandrovna'],Implicit,,"['the Marquis', 'he', 'your', 'you']","[[14684, 14695], [14725, 14727], [14767, 14771], [14789, 14792]]","[['Marqis De Griers'], ['Marqis De Griers'], ['Polina Alexandrovna'], ['Polina Alexandrovna']]",X,28,major,TheGambler,47,47,1,1,4,14666,14892
Q29-0,"What loving, friendly behaviour, to be sure!","[14897, 14941]",Alexis Ivanovitch,['Polina Alexandrovna'],Implicit,,[],[],[],X,29,major,TheGambler,47,47,1,1,4,14897,14941
Q30-0,"Yes, that is true. As soon as ever he learnt that I was likely to inherit something from her he began to pay me his addresses. I thought you ought to know that.","[14976, 15136]",Polina Alexandrovna,['Alexis Ivanovitch'],Implicit,,"['he', 'he', 'his', 'you']","[[15011, 15013], [15069, 15071], [15088, 15091], [15113, 15116]]","[['Marqis De Griers'], ['Marqis De Griers'], ['Marqis De Griers'], ['Alexis Ivanovitch']]",X,30,major,TheGambler,49,49,1,1,12,14976,15136
Q31-0,"Then he has only just begun his courting? Why, I thought he had been doing so a long while!","[15140, 15231]",Alexis Ivanovitch,['Polina Alexandrovna'],Implicit,,"['he', 'his', 'he']","[[15145, 15147], [15168, 15171], [15197, 15199]]","[['Marqis De Griers'], ['Marqis De Griers'], ['Marqis De Griers']]",X,31,major,TheGambler,50,50,1,1,4,15140,15231
Q32-0,"You _know_ he has not,","[15235, 15257]",Polina Alexandrovna,['Alexis Ivanovitch'],Explicit,retorted Polina,"['You', 'he']","[[15235, 15238], [15246, 15248]]","[['Alexis Ivanovitch'], ['Marqis De Griers']]",X,32,major,TheGambler,51,51,1,1,12,15235,15257
Q32-1,But where on earth did you pick up this Englishman?,"[15285, 15336]",Polina Alexandrovna,['Alexis Ivanovitch'],Explicit,retorted Polina,"['you', 'this Englishman']","[[15308, 15311], [15320, 15335]]","[['Alexis Ivanovitch'], ['Mr. Astley']]",X,32,major,TheGambler,51,51,1,1,12,15285,15336
Q33-0,I _knew_ you would ask about him!,"[15369, 15402]",Alexis Ivanovitch,['Polina Alexandrovna'],Implicit,,"['you', 'him']","[[15378, 15381], [15398, 15401]]","[['Polina Alexandrovna'], ['Mr. Astley']]",X,33,major,TheGambler,52,52,1,1,4,15369,15402
Q34-0,"He is very shy,","[15483, 15498]",Alexis Ivanovitch,['Polina Alexandrovna'],Anaphoric,I said,['He'],"[[15483, 15485]]",[['Mr. Astley']],X,34,major,TheGambler,53,53,1,1,4,15483,15498
Q34-1,"and susceptible. Also, he is in love with you.","[15509, 15555]",Alexis Ivanovitch,['Polina Alexandrovna'],Anaphoric,I said,"['he', 'you']","[[15532, 15534], [15551, 15554]]","[['Mr. Astley'], ['Polina Alexandrovna']]",X,34,major,TheGambler,53,53,1,1,4,15509,15555
Q35-0,"Yes, he _is_ in love with me,","[15559, 15588]",Polina Alexandrovna,['Alexis Ivanovitch'],Anaphoric,she replied,['he'],"[[15564, 15566]]",[['Mr. Astley']],X,35,major,TheGambler,54,54,1,1,12,15559,15588
Q36-0,"And he is ten times richer than the Frenchman. In fact, what does the Frenchman possess? To me it seems at least doubtful that he possesses anything at all.","[15605, 15761]",Alexis Ivanovitch,['Polina Alexandrovna'],Implicit,,"['he', 'the Frenchman', 'the Frenchman', 'he']","[[15609, 15611], [15637, 15650], [15671, 15684], [15732, 15734]]","[['Mr. Astley'], ['Marqis De Griers'], ['Marqis De Griers'], ['Marqis De Griers']]",X,36,major,TheGambler,55,55,1,1,4,15605,15761
Q37-0,"Oh, no, there is no doubt about it. He does possess some ch teau or other. Last night the General told me that for certain. _Now_ are you satisfied?","[15765, 15913]",Polina Alexandrovna,['Alexis Ivanovitch'],Implicit,,"['He', 'the General', 'you']","[[15801, 15803], [15851, 15862], [15899, 15902]]","[['Marqis De Griers'], ['The General'], ['Alexis Ivanovitch']]",X,37,major,TheGambler,56,56,1,1,12,15765,15913
Q38-0,"Nevertheless, in your place I should marry the Englishman.","[15917, 15975]",Alexis Ivanovitch,['Polina Alexandrovna'],Implicit,,"['your', 'the Englishman']","[[15934, 15938], [15960, 15974]]","[['Polina Alexandrovna'], ['Mr. Astley']]",X,38,major,TheGambler,57,57,1,1,4,15917,15975
Q39-0,And why?,"[15979, 15987]",Polina Alexandrovna,['Alexis Ivanovitch'],Explicit,asked Polina,[],[],[],X,39,major,TheGambler,58,58,1,1,12,15979,15987
Q40-0,"Because, though the Frenchman is the handsomer of the two, he is also the baser; whereas the Englishman is not only a man of honour, but ten times the wealthier of the pair.","[16005, 16178]",Alexis Ivanovitch,['Polina Alexandrovna'],Implicit,,"['the Frenchman', 'he', 'the Englishman']","[[16021, 16034], [16064, 16066], [16094, 16108]]","[['Marqis De Griers'], ['Marqis De Griers'], ['Mr. Astley']]",X,40,major,TheGambler,59,59,1,1,4,16005,16178
Q41-0,"Yes? But then the Frenchman is a marquis, and the cleverer of the two,","[16182, 16252]",Polina Alexandrovna,['Alexis Ivanovitch'],Explicit,remarked Polina,['the Frenchman'],"[[16196, 16209]]",[['Marqis De Griers']],X,41,major,TheGambler,60,60,1,1,12,16182,16252
Q42-0,Is that so?,"[16287, 16298]",Alexis Ivanovitch,['Polina Alexandrovna'],Anaphoric,I repeated,[],[],[],X,42,major,TheGambler,61,61,1,1,4,16287,16298
Q43-0,Yes; absolutely.,"[16314, 16330]",Polina Alexandrovna,['Alexis Ivanovitch'],Implicit,,[],[],[],X,43,major,TheGambler,62,62,1,1,12,16314,16330
Q44-0,"It amuses me to see you grow angry,","[16503, 16538]",Polina Alexandrovna,['Alexis Ivanovitch'],Anaphoric,she continued,['you'],"[[16523, 16526]]",[['Alexis Ivanovitch']],X,44,major,TheGambler,64,64,1,1,12,16503,16538
Q44-1,"However, inasmuch as I allow you to indulge in these questions and conjectures, you ought to pay me something for the privilege.","[16556, 16684]",Polina Alexandrovna,['Alexis Ivanovitch'],Anaphoric,she continued,"['you', 'you']","[[16585, 16588], [16636, 16639]]","[['Alexis Ivanovitch'], ['Alexis Ivanovitch']]",X,44,major,TheGambler,64,64,1,1,12,16556,16684
Q45-0,"I consider that I have a perfect right to put these questions to you,","[16688, 16757]",Alexis Ivanovitch,['Polina Alexandrovna'],Anaphoric,was my calm retort,['you'],"[[16753, 16756]]",[['Polina Alexandrovna']],X,45,major,TheGambler,65,65,1,1,4,16688,16757
Q45-1,"for the reason that I am ready to pay for them, and also care little what becomes of me.","[16780, 16868]",Alexis Ivanovitch,['Polina Alexandrovna'],Anaphoric,was my calm retort,[],[],[],X,45,major,TheGambler,65,65,1,1,4,16780,16868
Q46-0,"Last time you told me when on the Shlangenberg that at a word from me you would be ready to jump down a thousand feet into the abyss. Some day I may remind you of that saying, in order to see if you will be as good as your word. Yes, you may depend upon it that I shall do so. I hate you because I have allowed you to go to such lengths, and I also hate you and still more because you are so necessary to me. For the time being I want you, so I must keep you.","[16889, 17348]",Polina Alexandrovna,['Alexis Ivanovitch'],Implicit,,"['you', 'you', 'you', 'you', 'your', 'you', 'you', 'you', 'you', 'you', 'you', 'you']","[[16899, 16902], [16959, 16962], [17045, 17048], [17084, 17087], [17107, 17111], [17123, 17126], [17173, 17176], [17200, 17203], [17243, 17246], [17270, 17273], [17324, 17327], [17344, 17347]]","[['Alexis Ivanovitch'], ['Alexis Ivanovitch'], ['Alexis Ivanovitch'], ['Alexis Ivanovitch'], ['Alexis Ivanovitch'], ['Alexis Ivanovitch'], ['Alexis Ivanovitch'], ['Alexis Ivanovitch'], ['Alexis Ivanovitch'], ['Alexis Ivanovitch'], ['Alexis Ivanovitch'], ['Alexis Ivanovitch']]",X,46,major,TheGambler,67,67,1,1,12,16889,17348
Q47-0,May I ask you who is this Mlle. Blanche?,"[17531, 17571]",Alexis Ivanovitch,['Polina Alexandrovna'],Anaphoric,I inquired,['you'],"[[17541, 17544]]",[['Polina Alexandrovna']],X,47,major,TheGambler,69,69,1,1,4,17531,17571
Q48-0,"You _know_ who she is just Mlle. Blanche. Nothing further has transpired. Probably she will soon be Madame General that is to say, if the rumours that Grandmamma is nearing her end should prove true. Mlle. Blanche, with her mother and her cousin, the Marquis, know very well that, as things now stand, we are ruined.","[17650, 17966]",Polina Alexandrovna,['Alexis Ivanovitch'],Implicit,,"['You', 'we']","[[17650, 17653], [17952, 17954]]","[['Alexis Ivanovitch'], ['Polina Alexandrovna']]",X,48,major,TheGambler,70,70,1,1,12,17650,17966
Q49-0,And is the General at last in love?,"[17970, 18005]",Alexis Ivanovitch,['Polina Alexandrovna'],Implicit,,['the General'],"[[17977, 17988]]",[['The General']],X,49,major,TheGambler,71,71,1,1,4,17970,18005
Q50-0,"That has nothing to do with it. Listen to me. Take these 700 florins, and go and play roulette with them. Win as much for me as you can, for I am badly in need of money.","[18009, 18178]",Polina Alexandrovna,['Alexis Ivanovitch'],Implicit,,['you'],"[[18137, 18140]]",[['Alexis Ivanovitch']],X,50,major,TheGambler,72,72,1,1,12,18009,18178
Q51-0,"Do I, or do I not love her?","[19025, 19052]",Alexis Ivanovitch,['Alexis Ivanovitch'],Anaphoric,I put to myself,['her'],"[[19048, 19051]]",[['Polina Alexandrovna']],X,51,major,TheGambler,73,73,1,1,4,19025,19052
Q52-0,"And even if you were to _win_ much I should be compromised,","[32779, 32838]",The General,['Alexis Ivanovitch'],Anaphoric,he added,['you'],"[[32791, 32794]]",[['Alexis Ivanovitch']],X,52,major,TheGambler,86,86,1,1,16,32779,32838
Q52-1,"Of course I have no _right_ to order your actions, but you yourself will agree that...","[32876, 32962]",The General,['Alexis Ivanovitch'],Anaphoric,he added,"['your', 'you']","[[32913, 32917], [32931, 32934]]","[['Alexis Ivanovitch'], ['Alexis Ivanovitch']]",X,52,major,TheGambler,86,86,1,1,16,32876,32962
Q53-0,Why not?,"[33322, 33330]",Polina Alexandrovna,['Alexis Ivanovitch'],Anaphoric,she asked,[],[],[],X,53,major,TheGambler,87,87,1,1,12,33322,33330
Q54-0,"Because I wish to play _for myself_,","[33355, 33391]",Alexis Ivanovitch,['Polina Alexandrovna'],Anaphoric,I replied,[],[],[],X,54,major,TheGambler,88,88,1,1,4,33355,33391
Q54-1,That is my sole reason.,"[33443, 33466]",Alexis Ivanovitch,['Polina Alexandrovna'],Anaphoric,I replied,[],[],[],X,54,major,TheGambler,88,88,1,1,4,33443,33466
Q55-0,Then are you so certain that your roulette-playing will get us out of our difficulties?,"[33470, 33557]",Polina Alexandrovna,['Alexis Ivanovitch'],Anaphoric,she inquired,"['you', 'your', 'us']","[[33479, 33482], [33499, 33503], [33530, 33532]]","[['Alexis Ivanovitch'], ['Alexis Ivanovitch'], ['Polina Alexandrovna', 'Alexis Ivanovitch']]",X,55,major,TheGambler,89,89,1,1,12,33470,33557
Q56-0,"Yes,","[33621, 33625]",Alexis Ivanovitch,['Polina Alexandrovna'],Anaphoric,I said,[],[],[],X,56,major,TheGambler,90,90,1,1,4,33621,33625
Q57-0,"Possibly my certainty about winning may seem to you ridiculous; yet, pray leave me in peace.","[33644, 33736]",Alexis Ivanovitch,['Polina Alexandrovna'],Anaphoric,I said very seriously Yes and then added,['you'],"[[33692, 33695]]",[['Polina Alexandrovna']],X,57,major,TheGambler,90,90,1,1,4,33644,33736
Q58-0,"I am not unwilling so to do,","[34036, 34064]",Alexis Ivanovitch,['Polina Alexandrovna'],Anaphoric,I added,[],[],[],X,58,major,TheGambler,91,91,1,1,4,34036,34064
Q58-1,but in all probability I should lose.,"[34076, 34113]",Alexis Ivanovitch,['Polina Alexandrovna'],Anaphoric,I added,[],[],[],X,58,major,TheGambler,91,91,1,1,4,34076,34113
Q59-0,"Well, absurd though it be, I place great hopes on your playing of roulette,","[34117, 34192]",Polina Alexandrovna,['Alexis Ivanovitch'],Anaphoric,she remarked,[],[],[],X,59,major,TheGambler,92,92,1,1,12,34117,34192
Q59-1,"wherefore, you ought to play as my partner and on equal shares; wherefore, of course, you will do as I wish.","[34218, 34326]",Polina Alexandrovna,['Alexis Ivanovitch'],Anaphoric,she remarked,[],[],[],X,59,major,TheGambler,92,92,1,1,12,34218,34326
Q60-0,"That Mlle. Blanche,","[44688, 44707]",Mr. Astley,['Alexis Ivanovitch'],Anaphoric,he said,[],[],[],X,60,major,TheGambler,102,102,1,1,10,44688,44707
Q60-1,"Well, I have seen a good many women like her.","[44719, 44764]",Mr. Astley,['Alexis Ivanovitch'],Anaphoric,he said,[],[],[],X,60,major,TheGambler,102,102,1,1,10,44719,44764
Q61-0,It is so.,"[44935, 44944]",Mr. Astley,['Alexis Ivanovitch'],Anaphoric,he returned,[],[],[],X,61,major,TheGambler,103,103,1,1,10,44935,44944
Q62-0,Does Mlle. Polina like flowers?,"[44980, 45011]",Mr. Astley,['Alexis Ivanovitch'],Anaphoric,he resumed,['Mlle. Polina'],"[[44985, 44997]]",[['Polina Alexandrovna']],X,62,major,TheGambler,104,104,1,1,10,44980,45011
Q63-0,"I really cannot say,","[45015, 45035]",Alexis Ivanovitch,['Mr. Astley'],Anaphoric,was my reply,[],[],[],X,63,major,TheGambler,105,105,1,1,4,45015,45035
Q64-0,What? You cannot say?,"[45053, 45074]",Mr. Astley,['Alexis Ivanovitch'],Anaphoric,he cried,['You'],"[[45059, 45062]]",[['Alexis Ivanovitch']],X,64,major,TheGambler,106,106,1,1,10,45053,45074
