qID,qText,qSpan,speaker,addressee,qType,refExp,menTexts,menSpans,menEnts,speakerGender,dialogueTurn,speakerType,novel,startParaID,endParaID,startChapID,endChapID,speakerID,startByte,endByte
Q366-0,"My expressions startle you.  You must allow for an injured, angry woman.  But I will try to command myself.  I will not abuse him.  I will only tell you what I have found him.  Facts shall speak.  He was the intimate friend of my dear husband, who trusted and loved him, and thought him as good as himself.  The intimacy had been formed before our marriage.  I found them most intimate friends; and I, too, became excessively pleased with Mr Elliot, and entertained the highest opinion of him.  At nineteen, you know, one does not think very seriously; but Mr Elliot appeared to me quite as good as others, and much more agreeable than most others, and we were almost always together.  We were principally in town, living in very good style.  He was then the inferior in circumstances; he was then the poor one; he had chambers in the Temple, and it was as much as he could do to support the appearance of a gentleman.  He had always a home with us whenever he chose it; he was always welcome; he was like a brother.  My poor Charles, who had the finest, most generous spirit in the world, would have divided his last farthing with him; and I know that his purse was open to him; I know that he often assisted him.","[363678, 364892]",Mrs Smith,['Anne Elliot'],Anaphoric,she added,"['you', 'You', 'him', 'you', 'him', 'He', 'him', 'him', 'himself', 'Elliot', 'him', 'you', 'Mr Elliot', 'we', 'We', 'He', 'he', 'he', 'he', 'He', 'he', 'he', 'him', 'him', 'him']","[[363701, 363704], [363707, 363710], [363804, 363807], [363827, 363830], [363849, 363852], [363875, 363877], [363944, 363947], [363961, 363964], [363976, 363983], [364120, 364126], [364167, 364170], [364186, 364189], [364235, 364244], [364331, 364333], [364364, 364366], [364421, 364423], [364464, 364466], [364490, 364492], [364543, 364545], [364598, 364600], [364636, 364638], [364672, 364674], [364810, 364813], [364853, 364856], [364888, 364891]]","[['Anne Elliot'], ['Anne Elliot'], ['William Walter Elliot'], ['Anne Elliot'], ['William Walter Elliot'], ['William Walter Elliot'], ['William Walter Elliot'], ['William Walter Elliot'], ['William Walter Elliot'], ['Mr Elliot'], ['William Walter Elliot'], ['Anne Elliot'], ['William Walter Elliot'], ['William Walter Elliot'], ['William Walter Elliot', 'Mrs Smith'], ['William Walter Elliot'], ['William Walter Elliot'], ['William Walter Elliot'], ['William Walter Elliot'], ['William Walter Elliot'], ['William Walter Elliot'], ['William Walter Elliot'], ['William Walter Elliot'], ['William Walter Elliot'], ['William Walter Elliot']]",X,366,major,Persuasion,819,819,21,21,22,363678,364892
Q367-0,"This must have been about that very period of Mr Elliot's life,","[364896, 364959]",Anne Elliot,['Mrs Smith'],Explicit,said Anne,[' Mr Elliot'],"[[364941, 364951]]",[['William Walter Elliot']],X,367,major,Persuasion,820,820,21,21,1,364896,364959
Q367-1,"which has always excited my particular curiosity.  It must have been about the same time that he became known to my father and sister. I never knew him myself; I only heard of him; but there was a something in his conduct then, with regard to my father and sister, and afterwards in the circumstances of his marriage, which I never could quite reconcile with present times.  It seemed to announce a different sort of man.","[364973, 365394]",Anne Elliot,['Mrs Smith'],Explicit,said Anne,"['he', 'my', 'father', 'sister', 'him', 'him', 'his', 'father', 'sister', 'his']","[[365067, 365069], [365086, 365088], [365089, 365095], [365100, 365106], [365121, 365124], [365149, 365152], [365183, 365186], [365219, 365225], [365230, 365236], [365277, 365280]]","[['William Walter Elliot'], ['Anne Elliot'], ['Sir Walter Elliot'], ['Elizabeth'], ['William Walter Elliot'], ['William Walter Elliot'], ['William Walter Elliot'], ['Sir Walter Elliot'], ['Elizabeth'], ['William Walter Elliot']]",X,367,major,Persuasion,820,820,21,21,1,364973,365394
Q368-0,"I know it all, I know it all,","[365398, 365427]",Mrs Smith,['Anne Elliot'],Explicit,cried Mrs Smith,[],[],[],X,368,major,Persuasion,821,821,21,21,22,365398,365427
Q368-1,"He had been introduced to Sir Walter and your sister before I was acquainted with him, but I heard him speak of them for ever.  I know he was invited and encouraged, and I know he did not choose to go.  I can satisfy you, perhaps, on points which you would little expect; and as to his marriage, I knew all about it at the time.  I was privy to all the fors and againsts; I was the friend to whom he confided his hopes and plans; and though I did not know his wife previously, her inferior situation in society, indeed, rendered that impossible, yet I knew her all her life afterwards, or at least till within the last two years of her life, and can answer any question you may wish to put.","[365448, 366138]",Mrs Smith,['Anne Elliot'],Explicit,cried Mrs Smith,"['He', 'Sir Walter', 'sister', 'him', 'him', 'them', 'he', 'he', 'you', 'you', 'his', 'he', 'his', 'his', 'you']","[[365448, 365450], [365474, 365484], [365494, 365500], [365530, 365533], [365547, 365550], [365560, 365564], [365583, 365585], [365625, 365627], [365665, 365668], [365695, 365698], [365730, 365733], [365845, 365847], [365857, 365860], [365904, 365907], [366118, 366121]]","[['William Walter Elliot'], ['Sir Walter Elliot'], ['Elizabeth'], ['William Walter Elliot'], ['William Walter Elliot'], ['Elizabeth', 'Sir Walter Elliot'], ['William Walter Elliot'], ['William Walter Elliot'], ['Anne Elliot'], ['Anne Elliot'], ['Mr Elliot'], ['William Walter Elliot'], ['William Walter Elliot'], ['William Walter Elliot'], ['Anne Elliot']]",X,368,major,Persuasion,821,821,21,21,22,365448,366138
Q369-0,"Nay,","[366142, 366146]",Anne Elliot,['Mrs Smith'],Explicit,said Anne,[],[],[],X,369,major,Persuasion,822,822,21,21,1,366142,366146
Q369-1,"I have no particular enquiry to make about her.  I have always understood they were not a happy couple.  But I should like to know why, at that time of his life, he should slight my father's acquaintance as he did.  My father was certainly disposed to take very kind and proper notice of him.  Why did Mr Elliot draw back?","[366160, 366482]",Anne Elliot,['Mrs Smith'],Explicit,said Anne,"['his', 'he', 'my father', 'he', 'him', 'Mr Elliot']","[[366312, 366315], [366322, 366324], [366339, 366348], [366367, 366369], [366448, 366451], [366462, 366471]]","[['William Walter Elliot'], ['William Walter Elliot'], ['Sir Walter Elliot'], ['William Walter Elliot'], ['William Walter Elliot'], ['William Walter Elliot']]",X,369,major,Persuasion,822,822,21,21,1,366160,366482
Q370-0,"Mr Elliot,","[366486, 366496]",Mrs Smith,['Anne Elliot'],Explicit,replied Mrs Smith,['Mr Elliot'],"[[366486, 366495]]",[['William Walter Elliot']],X,370,major,Persuasion,823,823,21,21,22,366486,366496
Q370-1,"at that period of his life, had one object in view:  to make his fortune, and by a rather quicker process than the law.  He was determined to make it by marriage.  He was determined, at least, not to mar it by an imprudent marriage; and I know it was his belief (whether justly or not, of course I cannot decide), that your father and sister, in their civilities and invitations, were designing a match between the heir and the young lady, and it was impossible that such a match should have answered his ideas of wealth and independence.  That was his motive for drawing back, I can assure you.  He told me the whole story.  He had no concealments with me.  It was curious, that having just left you behind me in Bath, my first and principal acquaintance on marrying should be your cousin; and that, through him, I should be continually hearing of your father and sister.  He described one Miss Elliot, and I thought very affectionately of the other.","[366518, 367469]",Mrs Smith,['Anne Elliot'],Explicit,replied Mrs Smith,"['his', 'his', 'He', 'He', 'his', 'father', 'sister', 'their', 'his', 'you', 'He', 'He', 'you', 'cousin', 'him', 'father', 'sister', 'He', 'one Miss Elliot', 'of the other']","[[366536, 366539], [366579, 366582], [366639, 366641], [366682, 366684], [366769, 366772], [366842, 366848], [366853, 366859], [366864, 366869], [367067, 367070], [367109, 367112], [367115, 367117], [367144, 367146], [367215, 367218], [367301, 367307], [367327, 367330], [367372, 367378], [367383, 367389], [367392, 367394], [367405, 367420], [367456, 367468]]","[['William Walter Elliot'], ['William Walter Elliot'], ['William Walter Elliot'], ['William Walter Elliot'], ['William Walter Elliot'], ['Sir Walter Elliot'], ['Elizabeth'], ['Sir Walter Elliot', 'Elizabeth'], ['William Walter Elliot'], ['Anne Elliot'], ['William Walter Elliot'], ['William Walter Elliot'], ['Anne Elliot'], ['Mr Elliot'], ['William Walter Elliot'], ['Sir Walter Elliot'], ['Elizabeth'], ['William Walter Elliot'], ['Elizabeth'], ['Anne Elliot']]",X,370,major,Persuasion,823,823,21,21,22,366518,367469
Q371-0,"Perhaps,","[367473, 367481]",Anne Elliot,['Mrs Smith'],Explicit,cried Anne,[],[],[],X,371,major,Persuasion,824,824,21,21,1,367473,367481
Q371-1,you sometimes spoke of me to Mr Elliot?,"[367521, 367560]",Anne Elliot,['Mrs Smith'],Explicit,cried Anne,"['you', 'Mr Elliot']","[[367521, 367524], [367550, 367559]]","[['Mrs Smith'], ['William Walter Elliot']]",X,371,major,Persuasion,824,824,21,21,1,367521,367560
Q372-0,"To be sure I did; very often.  I used to boast of my own Anne Elliot, and vouch for your being a very different creature from--","[367564, 367691]",Mrs Smith,['Anne Elliot'],Implicit,,['Anne Elliot'],"[[367621, 367632]]",[['Anne Elliot']],X,372,major,Persuasion,825,825,21,21,22,367564,367691
Q373-0,"This accounts for something which Mr Elliot said last night,","[367730, 367790]",Anne Elliot,['Mrs Smith'],Explicit,cried Anne,['Mr Elliot'],"[[367764, 367773]]",[['William Walter Elliot']],X,373,major,Persuasion,827,827,21,21,1,367730,367790
Q373-1,"This explains it.  I found he had been used to hear of me.  I could not comprehend how.  What wild imaginations one forms where dear self is concerned!  How sure to be mistaken!  But I beg your pardon; I have interrupted you.  Mr Elliot married then completely for money? The circumstances, probably, which first opened your eyes to his character.","[367806, 368153]",Anne Elliot,['Mrs Smith'],Explicit,cried Anne,"['he', 'your', 'Mr Elliot', 'your']","[[367833, 367835], [367995, 367999], [368033, 368042], [368126, 368130]]","[['William Walter Elliot'], ['Anne Elliot'], ['William Walter Elliot'], ['Anne Elliot']]",X,373,major,Persuasion,827,827,21,21,1,367806,368153
Q374-0,"Oh! those things are too common. When one lives in the world, a man or woman's marrying for money is too common to strike one as it ought.  I was very young, and associated only with the young, and we were a thoughtless, gay set, without any strict rules of conduct.  We lived for enjoyment.  I think differently now; time and sickness and sorrow have given me other notions; but at that period I must own I saw nothing reprehensible in what Mr Elliot was doing.  'To do the best for himself,' passed as a duty.","[368193, 368704]",Mrs Smith,['Anne Elliot'],Implicit,,['Mr Elliot'],"[[368635, 368644]]",[['William Walter Elliot']],X,374,major,Persuasion,828,828,21,21,22,368193,368704
Q375-0,But was not she a very low woman?,"[368708, 368741]",Anne Elliot,['Mrs Smith'],Implicit,,[],[],[],X,375,major,Persuasion,829,829,21,21,1,368708,368741
Q376-0,"Yes; which I objected to, but he would not regard.  Money, money, was all that he wanted.  Her father was a grazier, her grandfather had been a butcher, but that was all nothing.  She was a fine woman, had had a decent education, was brought forward by some cousins, thrown by chance into Mr Elliot's company, and fell in love with him; and not a difficulty or a scruple was there on his side, with respect to her birth.  All his caution was spent in being secured of the real amount of her fortune, before he committed himself.  Depend upon it, whatever esteem Mr Elliot may have for his own situation in life now, as a young man he had not the smallest value for it.  His chance for the Kellynch estate was something, but all the honour of the family he held as cheap as dirt.  I have often heard him declare, that if baronetcies were saleable, anybody should have his for fifty pounds, arms and motto, name and livery included; but I will not pretend to repeat half that I used to hear him say on that subject.  It would not be fair; and yet you ought to have proof, for what is all this but assertion, and you shall have proof.","[368745, 369876]",Mrs Smith,['Anne Elliot'],Implicit,,"['he', 'he', ""Elliot's"", 'him', 'his', 'his', 'he', 'himself', 'Mr Elliot', 'his', 'he', 'His', 'he', 'him', 'his', 'him', 'you', 'you']","[[368775, 368777], [368824, 368826], [369037, 369045], [369077, 369080], [369129, 369132], [369171, 369174], [369252, 369254], [369265, 369272], [369307, 369316], [369330, 369333], [369376, 369378], [369415, 369418], [369498, 369500], [369544, 369547], [369612, 369615], [369734, 369737], [369790, 369793], [369855, 369858]]","[['William Walter Elliot'], ['William Walter Elliot'], ['Mr Elliot'], ['William Walter Elliot'], ['William Walter Elliot'], ['William Walter Elliot'], ['William Walter Elliot'], ['William Walter Elliot'], ['William Walter Elliot'], ['William Walter Elliot'], ['William Walter Elliot'], ['William Walter Elliot'], ['William Walter Elliot'], ['William Walter Elliot'], ['William Walter Elliot'], ['William Walter Elliot'], ['Anne Elliot'], ['Anne Elliot']]",X,376,major,Persuasion,830,830,21,21,22,368745,369876
Q377-0,"Indeed, my dear Mrs Smith, I want none,","[369880, 369919]",Anne Elliot,['Mrs Smith'],Explicit,cried Anne,['Mrs Smith'],"[[369896, 369905]]",[['Mrs Smith']],X,377,major,Persuasion,831,831,21,21,1,369880,369919
Q377-1,"You have asserted nothing contradictory to what Mr Elliot appeared to be some years ago.  This is all in confirmation, rather, of what we used to hear and believe.  I am more curious to know why he should be so different now.","[369935, 370160]",Anne Elliot,['Mrs Smith'],Explicit,cried Anne,"['You', 'Mr Elliot', 'we', 'he']","[[369935, 369938], [369983, 369992], [370070, 370072], [370130, 370132]]","[['Mrs Smith'], ['William Walter Elliot'], ['Sir Walter Elliot', 'Anne Elliot', 'Elizabeth'], ['William Walter Elliot']]",X,377,major,Persuasion,831,831,21,21,1,369935,370160
Q378-0,"But for my satisfaction, if you will have the goodness to ring for Mary; stay:  I am sure you will have the still greater goodness of going yourself into my bedroom, and bringing me the small inlaid box which you will find on the upper shelf of the closet.","[370164, 370420]",Mrs Smith,['Anne Elliot'],Implicit,,"['you', 'Mary', 'you', 'yourself', 'you']","[[370192, 370195], [370231, 370235], [370254, 370257], [370304, 370312], [370373, 370376]]","[['Anne Elliot'], ['Mary Musgrove'], ['Anne Elliot'], ['Anne Elliot'], ['Anne Elliot']]",X,378,major,Persuasion,832,832,21,21,22,370164,370420
Q379-0,"This is full of papers belonging to him, to my husband; a small portion only of what I had to look over when I lost him.  The letter I am looking for was one written by Mr Elliot to him before our marriage, and happened to be saved; why, one can hardly imagine.  But he was careless and immethodical, like other men, about those things; and when I came to examine his papers, I found it with others still more trivial, from different people scattered here and there, while many letters and memorandums of real importance had been destroyed.  Here it is; I would not burn it, because being even then very little satisfied with Mr Elliot, I was determined to preserve every document of former intimacy.  I have now another motive for being glad that I can produce it.","[370603, 371368]",Mrs Smith,['Anne Elliot'],Explicit,Mrs Smith sighing over it as she unlocked it said,"['Mr Elliot', 'Elliot']","[[370772, 370781], [371232, 371238]]","[['William Walter Elliot'], ['Mr Elliot']]",X,379,major,Persuasion,834,834,21,21,22,370603,371368
Q380-0,"The language, I know, is highly disrespectful.  Though I have forgot the exact terms, I have a perfect impression of the general meaning. But it shows you the man.  Mark his professions to my poor husband. Can any thing be stronger?","[372624, 372856]",Mrs Smith,['Anne Elliot'],Explicit,Mrs Smith observing the high colour in her face said,"['you', 'his']","[[372775, 372778], [372794, 372797]]","[['Anne Elliot'], ['William Walter Elliot']]",X,380,major,Persuasion,839,839,21,21,22,372624,372856
Q381-0,Thank you.  This is full proof undoubtedly; proof of every thing you were saying.  But why be acquainted with us now?,"[373302, 373419]",Anne Elliot,['Mrs Smith'],Anaphoric,she had been meditating over and say,"['you', 'you', 'us']","[[373308, 373311], [373367, 373370], [373412, 373414]]","[['Mrs Smith'], ['Mrs Smith'], ['Anne Elliot']]",X,381,major,Persuasion,841,841,21,21,1,373302,373419
Q382-0,"I can explain this too,","[373423, 373446]",Mrs Smith,['Anne Elliot'],Explicit,cried Mrs Smith,[],[],[],X,382,major,Persuasion,842,842,21,21,22,373423,373446
Q383-0,Can you really?,"[373476, 373491]",Anne Elliot,['Mrs Smith'],Implicit,,['you'],"[[373480, 373483]]",[['Mrs Smith']],X,383,major,Persuasion,843,843,21,21,1,373476,373491
Q384-0,"Yes.  I have shewn you Mr Elliot as he was a dozen years ago, and I will shew him as he is now.  I cannot produce written proof again, but I can give as authentic oral testimony as you can desire, of what he is now wanting, and what he is now doing.  He is no hypocrite now.  He truly wants to marry you.  His present attentions to your family are very sincere:  quite from the heart.  I will give you my authority: his friend Colonel Wallis.","[373495, 373937]",Mrs Smith,['Anne Elliot'],Implicit,,"['you', 'Mr Elliot', 'he', 'him', 'he', 'you', 'he', 'he', 'He', 'He', 'you', 'His', 'your family', 'you', 'his', 'Colonel Wallis']","[[373514, 373517], [373518, 373527], [373531, 373533], [373573, 373576], [373580, 373582], [373676, 373679], [373700, 373702], [373728, 373730], [373746, 373748], [373771, 373773], [373795, 373798], [373801, 373804], [373827, 373838], [373893, 373896], [373911, 373914], [373922, 373936]]","[['Anne Elliot'], ['William Walter Elliot'], ['William Walter Elliot'], ['William Walter Elliot'], ['William Walter Elliot'], ['Anne Elliot'], ['William Walter Elliot'], ['William Walter Elliot'], ['William Walter Elliot'], ['William Walter Elliot'], ['Anne Elliot'], ['William Walter Elliot'], ['Anne Elliot'], ['Anne Elliot'], ['William Walter Elliot'], ['Colonel Wallis']]",X,384,major,Persuasion,844,844,21,21,22,373495,373937
Q385-0,Colonel Wallis! you are acquainted with him?,"[373941, 373985]",Anne Elliot,['Mrs Smith'],Implicit,,"['Colonel Wallis', 'you', 'him']","[[373941, 373955], [373957, 373960], [373981, 373984]]","[['Colonel Wallis'], ['Mrs Smith'], ['Colonel Wallis']]",X,385,major,Persuasion,845,845,21,21,1,373941,373985
Q386-0,"No.  It does not come to me in quite so direct a line as that; it takes a bend or two, but nothing of consequence.  The stream is as good as at first; the little rubbish it collects in the turnings is easily moved away.  Mr Elliot talks unreservedly to Colonel Wallis of his views on you, which said Colonel Wallis, I imagine to be, in himself, a sensible, careful, discerning sort of character; but Colonel Wallis has a very pretty silly wife, to whom he tells things which he had better not, and he repeats it all to her.  She in the overflowing spirits of her recovery, repeats it all to her nurse; and the nurse  knowing my acquaintance with you, very naturally brings it all to me.  On Monday evening, my good friend Mrs Rooke let me thus much into the secrets of Marlborough Buildings.  When I talked of a whole history, therefore, you see I was not romancing so much as you supposed.","[373989, 374879]",Mrs Smith,['Anne Elliot'],Implicit,,"['Mr Elliot', 'Colonel Wallis', 'his', 'you', 'Colonel Wallis', 'himself', 'Colonel Wallis', 'he', 'he', 'he', 'you', 'you ', 'you']","[[374210, 374219], [374242, 374256], [374260, 374263], [374273, 374276], [374289, 374303], [374325, 374332], [374389, 374403], [374442, 374444], [374464, 374466], [374487, 374489], [374635, 374638], [374827, 374831], [374866, 374869]]","[['William Walter Elliot'], ['Colonel Wallis'], ['William Walter Elliot'], ['Anne Elliot'], ['Colonel Wallis'], ['Colonel Wallis'], ['Colonel Wallis'], ['Colonel Wallis'], ['Colonel Wallis'], ['Colonel Wallis'], ['Anne Elliot'], ['Anne Elliot'], ['Anne Elliot']]",X,386,major,Persuasion,846,846,21,21,22,373989,374879
Q387-0,"My dear Mrs Smith, your authority is deficient.  This will not do.  Mr Elliot's having any views on me will not in the least account for the efforts he made towards a reconciliation with my father.  That was all prior to my coming to Bath.  I found them on the most friendly terms when I arrived.","[374883, 375179]",Anne Elliot,['Mrs Smith'],Implicit,,"['Mrs Smith', 'your ', ' Mr Elliot', 'he', 'my father', 'them']","[[374891, 374900], [374902, 374907], [374950, 374960], [375032, 375034], [375070, 375079], [375132, 375136]]","[['Mrs Smith'], ['Mrs Smith'], ['William Walter Elliot'], ['William Walter Elliot'], ['Sir Walter Elliot'], ['Sir Walter Elliot', 'William Walter Elliot']]",X,387,major,Persuasion,847,847,21,21,1,374883,375179
Q388-0,"I know you did; I know it all perfectly, but--","[375183, 375229]",Mrs Smith,['Anne Elliot'],Implicit,,['you'],"[[375190, 375193]]",[['Anne Elliot']],X,388,major,Persuasion,848,848,21,21,22,375183,375229
Q389-0,"Indeed, Mrs Smith, we must not expect to get real information in such a line.  Facts or opinions which are to pass through the hands of so many, to be misconceived by folly in one, and ignorance in another, can hardly have much truth left.","[375233, 375472]",Anne Elliot,['Mrs Smith'],Implicit,,['Mrs Smith'],"[[375241, 375250]]",[['Mrs Smith']],X,389,major,Persuasion,849,849,21,21,1,375233,375472
Q390-0,"Only give me a hearing.  You will soon be able to judge of the general credit due, by listening to some particulars which you can yourself immediately contradict or confirm.  Nobody supposes that you were his first inducement.  He had seen you indeed, before he came to Bath, and admired you, but without knowing it to be you.  So says my historian, at least.  Is this true?  Did he see you last summer or autumn, 'somewhere down in the west,' to use her own words, without knowing it to be you?","[375476, 375971]",Mrs Smith,['Anne Elliot'],Implicit,,"['You', 'you', 'you', 'He', 'you', 'he', 'you', 'you', 'he', 'you', 'you']","[[375501, 375504], [375598, 375601], [375672, 375675], [375704, 375706], [375716, 375719], [375735, 375737], [375764, 375767], [375798, 375801], [375856, 375858], [375863, 375866], [375967, 375970]]","[['Anne Elliot'], ['Anne Elliot'], ['Anne Elliot'], ['William Walter Elliot'], ['Anne Elliot'], ['William Walter Elliot'], ['Anne Elliot'], ['Anne Elliot'], ['William Walter Elliot'], ['Anne Elliot'], ['Anne Elliot']]",X,390,major,Persuasion,850,850,21,21,22,375476,375971
Q391-0,He certainly did.  So far it is very true.  At Lyme.  I happened to be at Lyme.,"[375975, 376054]",Anne Elliot,['Mrs Smith'],Implicit,,['He'],"[[375975, 375977]]",[['William Walter Elliot']],X,391,major,Persuasion,851,851,21,21,1,375975,376054
Q392-0,"Well,","[376058, 376063]",Mrs Smith,['Anne Elliot'],Explicit,continued Mrs Smith,[],[],[],X,392,major,Persuasion,852,852,21,21,22,376058,376063
Q392-1,"grant my friend the credit due to the establishment of the first point asserted.  He saw you then at Lyme, and liked you so well as to be exceedingly pleased to meet with you again in Camden Place, as Miss Anne Elliot, and from that moment, I have no doubt, had a double motive in his visits there.  But there was another, and an earlier, which I will now explain.  If there is anything in my story which you know to be either false or improbable, stop me.  My account states, that your sister's friend, the lady now staying with you, whom I have heard you mention, came to Bath with Miss Elliot and Sir Walter as long ago as September (in short when they first came themselves), and has been staying there ever since; that she is a clever, insinuating, handsome woman, poor and plausible, and altogether such in situation and manner, as to give a general idea, among Sir Walter's acquaintance, of her meaning to be Lady Elliot, and as general a surprise that Miss Elliot should be apparently, blind to the danger.","[376101, 377115]",Mrs Smith,['Anne Elliot'],Explicit,continued Mrs Smith,"['He', 'you', 'you', 'you', 'Miss Anne Elliot', 'his', 'you', ""your sister's friend"", 'you', 'you', 'Elliot', 'Sir Walter', 'she', 'Sir Walter', 'her', 'Elliot']","[[376183, 376185], [376190, 376193], [376218, 376221], [376272, 376275], [376302, 376318], [376382, 376385], [376506, 376509], [376583, 376603], [376631, 376634], [376654, 376657], [376690, 376696], [376701, 376711], [376825, 376828], [376969, 376979], [376999, 377002], [377066, 377072]]","[['William Walter Elliot'], ['Anne Elliot'], ['Anne Elliot'], ['Anne Elliot'], ['Anne Elliot'], ['William Walter Elliot'], ['Anne Elliot'], ['Mrs Clay'], ['Anne Elliot'], ['Anne Elliot'], ['Elizabeth'], ['Sir Walter Elliot'], ['Mrs Clay'], ['Sir Walter Elliot'], ['Mrs Clay'], ['Elizabeth']]",X,392,major,Persuasion,852,852,21,21,22,376101,377115
