qID,qText,qSpan,speaker,addressee,qType,refExp,menTexts,menSpans,menEnts,speakerGender,dialogueTurn,speakerType,novel,startParaID,endParaID,startChapID,endChapID,speakerID,startByte,endByte
Q208-1,"He fancied that if he went with us, he should find you close by: he fancied everybody to be living in Uppercross; and when he discovered that Lady Russell lived three miles off, his heart failed him, and he had not courage to come.  That is the fact, upon my honour. Mary knows it is.","[233960, 234244]",Charles Musgrove,"['Anne Elliot', 'Mary Musgrove', 'Lady Russell']",Explicit,Charles laughed again and said,"['He', 'he', 'us', 'he', 'you', 'he', 'he', 'Lady Russell', 'his', 'him', 'he', 'Mary']","[[233960, 233962], [233979, 233981], [233992, 233994], [233996, 233998], [234011, 234014], [234025, 234027], [234083, 234085], [234102, 234114], [234138, 234141], [234155, 234158], [234164, 234166], [234227, 234231]]","[['Captain Benwick'], ['Captain Benwick'], ['Charles Musgrove'], ['Captain Benwick'], ['Anne Elliot'], ['Captain Benwick'], ['Captain Benwick'], ['Lady Russell'], ['Captain Benwick'], ['Captain Benwick'], ['Captain Benwick'], ['Mary Musgrove']]",X,208,major,Persuasion,511,511,14,14,6,233960,234244
Q209-0,"Oh! he talks of you,","[234657, 234677]",Charles Musgrove,"['Anne Elliot', 'Mary Musgrove', 'Lady Russell']",Explicit,cried Charles,"['he', 'you']","[[234661, 234663], [234673, 234676]]","[['Captain Benwick'], ['Anne Elliot']]",X,209,major,Persuasion,513,513,14,14,6,234657,234677
Q209-1,in such terms--,"[234695, 234710]",Charles Musgrove,"['Anne Elliot', 'Mary Musgrove', 'Lady Russell']",Explicit,cried Charles,[],[],[],X,209,major,Persuasion,513,513,14,14,6,234695,234710
Q210-0,"I declare, Charles, I never heard him mention Anne twice all the time I was there.  I declare, Anne, he never talks of you at all.","[234735, 234865]",Mary Musgrove,"['Anne Elliot', 'Charles Musgrove', 'Lady Russell']",Explicit,Mary interrupted him,"['Charles', 'him', 'Anne', 'Anne', 'he', 'you']","[[234746, 234753], [234769, 234772], [234781, 234785], [234830, 234834], [234836, 234838], [234854, 234857]]","[['Charles Musgrove'], ['Captain Benwick'], ['Anne Elliot'], ['Anne Elliot'], ['Captain Benwick'], ['Anne Elliot']]",X,210,minor,Persuasion,513,513,14,14,16,234735,234865
Q211-0,"No,","[234869, 234872]",Charles Musgrove,"['Anne Elliot', 'Mary Musgrove', 'Lady Russell']",Explicit,admitted Charles,[],[],[],X,211,major,Persuasion,514,514,14,14,6,234869,234872
Q211-1,"I do not know that he ever does, in a general way; but however, it is a very clear thing that he admires you exceedingly.  His head is full of some books that he is reading upon your recommendation, and he wants to talk to you about them; he has found out something or other in one of them which he thinks--oh! I cannot pretend to remember it, but it was something very fine--I overheard him telling Henrietta all about it; and then 'Miss Elliot' was spoken of in the highest terms!  Now Mary, I declare it was so, I heard it myself, and you were in the other room.  'Elegance, sweetness, beauty.' Oh! there was no end of Miss Elliot's charms.","[234893, 235536]",Charles Musgrove,"['Anne Elliot', 'Mary Musgrove', 'Lady Russell']",Explicit,admitted Charles,"['he', 'he', 'you', 'His', 'he', 'your', 'he', 'you', 'he', 'he', 'him', 'Henrietta', 'Miss Elliot', 'Mary', ""Miss Elliot's""]","[[234912, 234914], [234987, 234989], [234998, 235001], [235016, 235019], [235052, 235054], [235071, 235075], [235096, 235098], [235116, 235119], [235132, 235134], [235189, 235191], [235281, 235284], [235293, 235302], [235327, 235338], [235381, 235385], [235515, 235528]]","[['Captain Benwick'], ['Captain Benwick'], ['Anne Elliot'], ['Captain Benwick'], ['Captain Benwick'], ['Anne Elliot'], ['Captain Benwick'], ['Anne Elliot'], ['Captain Benwick'], ['Captain Benwick'], ['Captain Benwick'], ['Henrietta Musgrove'], ['Anne Elliot'], ['Mary Musgrove'], ['Anne Elliot']]",X,211,major,Persuasion,514,514,14,14,6,234893,235536
Q212-0,"And I am sure,","[235540, 235554]",Mary Musgrove,"['Anne Elliot', 'Charles Musgrove', 'Lady Russell']",Explicit,cried Mary,[],[],[],X,212,minor,Persuasion,515,515,14,14,16,235540,235554
Q212-1,"it was a very little to his credit, if he did.  Miss Harville only died last June.  Such a heart is very little worth having; is it, Lady Russell?  I am sure you will agree with me.","[235577, 235758]",Mary Musgrove,"['Anne Elliot', 'Charles Musgrove', 'Lady Russell']",Explicit,cried Mary,"['his', 'he', 'Miss Harville', 'Lady Russell']","[[235601, 235604], [235616, 235618], [235625, 235638], [235710, 235722]]","[['Captain Benwick'], ['Captain Benwick'], ['Mrs. Harville'], ['Lady Russell']]",X,212,minor,Persuasion,515,515,14,14,16,235577,235758
Q213-0,"I must see Captain Benwick before I decide,","[235762, 235805]",Lady Russell,"['Anne Elliot', 'Mary Musgrove', 'Charles Musgrove']",Explicit,said Lady Russell,['Captain Benwick'],"[[235773, 235788]]",[['Captain Benwick']],X,213,minor,Persuasion,516,516,14,14,12,235762,235805
Q214-0,"And that you are very likely to do very soon, I can tell you, ma'am,","[235837, 235905]",Charles Musgrove,"['Anne Elliot', 'Mary Musgrove', 'Lady Russell']",Explicit,said Charles,"[""ma'am""]","[[235899, 235904]]",[['Lady Russell']],X,214,major,Persuasion,517,517,14,14,6,235837,235905
Q214-1,"Though he had not nerves for coming away with us, and setting off again afterwards to pay a formal visit here, he will make his way over to Kellynch one day by himself, you may depend on it.  I told him the distance and the road, and I told him of the church's being so very well worth seeing; for as he has a taste for those sort of things, I thought that would be a good excuse, and he listened with all his understanding and soul; and I am sure from his manner that you will have him calling here soon.  So, I give you notice, Lady Russell.","[235923, 236466]",Charles Musgrove,"['Anne Elliot', 'Mary Musgrove', 'Lady Russell']",Explicit,said Charles,"['he', 'us', 'he', 'his', 'himself', 'him', 'him', 'he', 'he', 'his', 'his', 'him', 'you', 'Lady Russell']","[[235930, 235932], [235969, 235971], [236034, 236036], [236047, 236050], [236083, 236090], [236122, 236125], [236164, 236167], [236224, 236226], [236308, 236310], [236329, 236332], [236376, 236379], [236406, 236409], [236441, 236444], [236453, 236465]]","[['Captain Benwick'], ['Charles Musgrove', 'Mary Musgrove'], ['Captain Benwick'], ['Captain Benwick'], ['Captain Benwick'], ['Captain Benwick'], ['Captain Benwick'], ['Captain Benwick'], ['Captain Benwick'], ['Captain Benwick'], ['Captain Benwick'], ['Captain Benwick'], ['Lady Russell'], ['Lady Russell']]",X,214,major,Persuasion,517,517,14,14,6,235923,236466
Q215-0,"Any acquaintance of Anne's will always be welcome to me,","[236470, 236526]",Lady Russell,"['Anne Elliot', 'Mary Musgrove', 'Charles Musgrove']",Explicit,was Lady Russells kind answer,['Anne'],"[[236490, 236494]]",[['Anne Elliot']],X,215,minor,Persuasion,518,518,14,14,12,236470,236526
Q216-0,"Oh! as to being Anne's acquaintance,","[236562, 236598]",Mary Musgrove,"['Anne Elliot', 'Charles Musgrove', 'Lady Russell']",Explicit,said Mary,['Anne'],"[[236578, 236582]]",[['Anne Elliot']],X,216,minor,Persuasion,519,519,14,14,16,236562,236598
Q216-1,"I think he is rather my acquaintance, for I have been seeing him every day this last fortnight.","[236612, 236707]",Mary Musgrove,"['Anne Elliot', 'Charles Musgrove', 'Lady Russell']",Explicit,said Mary,"['he', 'him']","[[236620, 236622], [236673, 236676]]","[['Captain Benwick'], ['Captain Benwick']]",X,216,minor,Persuasion,519,519,14,14,16,236612,236707
Q217-0,"Well, as your joint acquaintance, then, I shall be very happy to see Captain Benwick.","[236711, 236796]",Lady Russell,"['Anne Elliot', 'Mary Musgrove', 'Charles Musgrove']",Implicit,,"['your', 'Captain Benwick']","[[236720, 236724], [236780, 236795]]","[['Mary', 'Anne Elliot'], ['Captain Benwick']]",X,217,minor,Persuasion,520,520,14,14,12,236711,236796
Q218-0,"You will not find anything very agreeable in him, I assure you, ma'am. He is one of the dullest young men that ever lived.  He has walked with me, sometimes, from one end of the sands to the other, without saying a word.  He is not at all a well-bred young man.  I am sure you will not like him.","[236800, 237095]",Mary Musgrove,"['Anne Elliot', 'Charles Musgrove', 'Lady Russell']",Implicit,,"['You', 'him', 'you', ""ma'am"", 'He ', 'He', 'He', 'you', 'him']","[[236800, 236803], [236845, 236848], [236859, 236862], [236864, 236869], [236871, 236874], [236924, 236926], [237022, 237024], [237073, 237076], [237091, 237094]]","[['Lady Russell'], ['Captain Benwick'], ['Lady Russell'], ['Lady Russell'], ['Captain Benwick'], ['Captain Benwick'], ['Captain Benwick'], ['Lady Russell'], ['Captain Benwick']]",X,218,minor,Persuasion,521,521,14,14,16,236800,237095
Q219-0,"There we differ, Mary,","[237099, 237121]",Anne Elliot,"['Lady Russell', 'Charles Musgrove', 'Mary Musgrove']",Explicit,said Anne,"['we', 'Mary']","[[237105, 237107], [237116, 237120]]","[['Anne Elliot', 'Mary Musgrove'], ['Mary Musgrove']]",X,219,major,Persuasion,522,522,14,14,1,237099,237121
Q219-1,"I think Lady Russell would like him.  I think she would be so much pleased with his mind, that she would very soon see no deficiency in his manner.","[237136, 237283]",Anne Elliot,"['Lady Russell', 'Charles Musgrove', 'Mary Musgrove']",Explicit,said Anne,"[' Lady Russell', 'she', 'his', 'she', 'his']","[[237143, 237156], [237182, 237185], [237216, 237219], [237231, 237234], [237272, 237275]]","[['Lady Russell'], ['Lady Russell'], ['Captain Benwick'], ['Lady Russell'], ['Captain Benwick']]",X,219,major,Persuasion,522,522,14,14,1,237136,237283
Q220-0,"So do I, Anne,","[237287, 237301]",Charles Musgrove,"['Anne Elliot', 'Mary Musgrove', 'Lady Russell']",Explicit,said Charles,['Anne'],"[[237296, 237300]]",[['Anne Elliot']],X,220,major,Persuasion,523,523,14,14,6,237287,237301
Q220-1,"I am sure Lady Russell would like him. He is just Lady Russell's sort.  Give him a book, and he will read all day long.","[237319, 237438]",Charles Musgrove,"['Anne Elliot', 'Mary Musgrove', 'Lady Russell']",Explicit,said Charles,"['Lady Russell', 'him', 'He', ""Lady Russell's"", 'him', 'he']","[[237329, 237341], [237353, 237356], [237358, 237360], [237369, 237383], [237396, 237399], [237412, 237414]]","[['Lady Russell'], ['Captain Benwick'], ['Captain Benwick'], ['Lady Russell'], ['Captain Benwick'], ['Captain Benwick']]",X,220,major,Persuasion,523,523,14,14,6,237319,237438
Q221-0,"Yes, that he will!","[237442, 237460]",Mary Musgrove,"['Anne Elliot', 'Charles Musgrove', 'Lady Russell']",Explicit,exclaimed Mary,['he'],"[[237452, 237454]]",[['Captain Benwick']],X,221,minor,Persuasion,524,524,14,14,16,237442,237460
Q221-1,"He will sit poring over his book, and not know when a person speaks to him, or when one drops one's scissors, or anything that happens.  Do you think Lady Russell would like that?","[237492, 237671]",Mary Musgrove,"['Anne Elliot', 'Charles Musgrove', 'Lady Russell']",Explicit,exclaimed Mary,"['He', 'his', 'him', 'Lady Russell']","[[237492, 237494], [237516, 237519], [237563, 237566], [237642, 237654]]","[['Captain Benwick'], ['Captain Benwick'], ['Captain Benwick'], ['Lady Russell']]",X,221,minor,Persuasion,524,524,14,14,16,237492,237671
Q222-0,"Upon my word,","[237714, 237727]",Lady Russell,"['Anne Elliot', 'Mary Musgrove', 'Charles Musgrove']",Anaphoric,said she,[],[],[],X,222,minor,Persuasion,525,525,14,14,12,237714,237727
Q222-1,"I should not have supposed that my opinion of any one could have admitted of such difference of conjecture, steady and matter of fact as I may call myself.  I have really a curiosity to see the person who can give occasion to such directly opposite notions.  I wish he may be induced to call here.  And when he does, Mary, you may depend upon hearing my opinion; but I am determined not to judge him beforehand.","[237740, 238151]",Lady Russell,"['Anne Elliot', 'Mary Musgrove', 'Charles Musgrove']",Anaphoric,said she,"['he', 'he', 'Mary', 'you', 'him']","[[238006, 238008], [238048, 238050], [238057, 238061], [238063, 238066], [238136, 238139]]","[['Captain Benwick'], ['Captain Benwick'], ['Mary Musgrove'], ['Mary Musgrove'], ['Captain Benwick']]",X,222,minor,Persuasion,525,525,14,14,12,237740,238151
Q223-0,"You will not like him, I will answer for it.","[238155, 238199]",Mary Musgrove,"['Anne Elliot', 'Charles Musgrove', 'Lady Russell']",Implicit,,"['You', 'him']","[[238155, 238158], [238173, 238176]]","[['Lady Russell'], ['Captain Benwick']]",X,223,minor,Persuasion,526,526,14,14,16,238155,238199
Q224-0,"He is a man,","[238349, 238361]",Lady Russell,"['Anne Elliot', 'Mary Musgrove', 'Charles Musgrove']",Explicit,said Lady Russell,[],[],[],X,224,minor,Persuasion,528,528,14,14,12,238349,238361
Q224-1,"whom I have no wish to see.  His declining to be on cordial terms with the head of his family, has left a very strong impression in his disfavour with me.","[238383, 238537]",Lady Russell,"['Anne Elliot', 'Mary Musgrove', 'Charles Musgrove']",Explicit,said Lady Russell,[],[],[],X,224,minor,Persuasion,528,528,14,14,12,238383,238537
Q225-0,"I hope I shall remember, in future,","[242391, 242426]",Lady Russell,['Anne Elliot'],Explicit,said Lady Russell,[],[],[],X,225,minor,Persuasion,537,537,14,14,12,242391,242426
Q225-1,not to call at Uppercross in the Christmas holidays.,"[242495, 242547]",Lady Russell,['Anne Elliot'],Explicit,said Lady Russell,[],[],[],X,225,minor,Persuasion,537,537,14,14,12,242495,242547
Q226-0,Oh! when shall I leave you again?,"[245231, 245264]",Anne Elliot,['Anne Elliot'],Explicit,Anne entered it with a sinking heart anticipating an imprisonment of many months and anxiously saying to herself,[],[],[],X,226,major,Persuasion,545,545,15,15,1,245231,245264
Q227-0,"a most charming woman, quite worthy of being known in Camden Place,","[253893, 253960]",William Walter Elliot,['Sir Walter Elliot'],Explicit,Mr Elliot spoke of her as,[],[],[],X,227,minor,Persuasion,556,556,15,15,30,253893,253960
Q228-0,How is Mary looking?,"[255579, 255599]",Sir Walter Elliot,"['Mrs Clay', 'Anne Elliot', 'Elizabeth']",Explicit,said Sir Walter,['Mary'],"[[255586, 255590]]",[['Mary Musgrove']],X,228,minor,Persuasion,557,557,15,15,26,255579,255599
Q228-1,"The last time I saw her she had a red nose, but I hope that may not happen every day.","[255654, 255739]",Sir Walter Elliot,"['Mrs Clay', 'Anne Elliot', 'Elizabeth']",Explicit,said Sir Walter,"['her', 'she']","[[255674, 255677], [255678, 255681]]","[['Mary Musgrove'], ['Mary Musgrove']]",X,228,minor,Persuasion,557,557,15,15,26,255654,255739
Q229-0,"Oh! no, that must have been quite accidental.  In general she has been in very good health and very good looks since Michaelmas.","[255743, 255871]",Anne Elliot,"['Elizabeth', 'Sir Walter Elliot', 'Mrs Clay']",Implicit,,['she'],"[[255801, 255804]]",[['Mary Musgrove']],X,229,major,Persuasion,558,558,15,15,1,255743,255871
Q230-0,"If I thought it would not tempt her to go out in sharp winds, and grow coarse, I would send her a new hat and pelisse.","[255875, 255993]",Sir Walter Elliot,"['Mrs Clay', 'Anne Elliot', 'Elizabeth']",Implicit,,"['her', 'her']","[[255907, 255910], [255967, 255970]]","[['Mary Musgrove'], ['Mary Musgrove']]",X,230,minor,Persuasion,559,559,15,15,26,255875,255993
Q231-0,"The notions of a young man of one or two and twenty,","[259327, 259379]",William Walter Elliot,"['Mrs Clay', 'Sir Walter Elliot', 'Anne Elliot', 'Elizabeth']",Anaphoric,said he,[],[],[],X,231,minor,Persuasion,563,563,15,15,30,259327,259379
Q231-1,"as to what is necessary in manners to make him quite the thing, are more absurd, I believe, than those of any other set of beings in the world. The folly of the means they often employ is only to be equalled by the folly of what they have in view.","[259391, 259638]",William Walter Elliot,"['Mrs Clay', 'Sir Walter Elliot', 'Anne Elliot', 'Elizabeth']",Anaphoric,said he,[],[],[],X,231,minor,Persuasion,563,563,15,15,30,259391,259638
Q232-0,"That must not be any reason, indeed.  I assure you I feel it none.  She is nothing to me, compared with you;","[261329, 261437]",Elizabeth,"['Sir Walter Elliot', 'Mrs Clay']",Explicit,Elizabeth was replying,"['you ', 'She', 'you']","[[261376, 261380], [261397, 261400], [261433, 261436]]","[['Mrs Clay'], ['Anne Elliot'], ['Mrs Clay']]",X,232,minor,Persuasion,569,569,16,16,8,261329,261437
Q233-0,"My dear madam, this must not be.  As yet, you have seen nothing of Bath.  You have been here only to be useful.  You must not run away from us now.  You must stay to be acquainted with Mrs Wallis, the beautiful Mrs Wallis.  To your fine mind, I well know the sight of beauty is a real gratification.","[261490, 261789]",Sir Walter Elliot,"['Elizabeth', 'Mrs Clay']",Anaphoric,her father say,"['My dear madam', 'you', 'You', 'You', 'us', 'You', 'Mrs Wallis', 'Mrs Wallis']","[[261490, 261503], [261532, 261535], [261564, 261567], [261603, 261606], [261630, 261632], [261639, 261642], [261675, 261685], [261701, 261711]]","[['Mrs Clay'], ['Mrs Clay'], ['Mrs Clay'], ['Mrs Clay'], ['Elizabeth', 'Sir Walter Elliot'], ['Mrs Clay'], ['Mrs Wallis'], ['Mrs Wallis']]",X,233,minor,Persuasion,569,569,16,16,26,261490,261789
Q234-0,"No, nothing.","[262442, 262454]",Anne Elliot,['Sir Walter Elliot'],Implicit,,[],[],[],X,234,major,Persuasion,571,571,16,16,1,262442,262454
Q235-0,"Merely Gowland,","[262458, 262473]",Sir Walter Elliot,['Anne Elliot'],Anaphoric,he supposed,[],[],[],X,235,minor,Persuasion,571,571,16,16,26,262458,262473
Q236-0,"No, nothing at all.","[262489, 262508]",Anne Elliot,['Sir Walter Elliot'],Implicit,,[],[],[],X,236,major,Persuasion,571,571,16,16,1,262489,262508
Q237-0,"certainly you cannot do better than to continue as you are; you cannot be better than well; or I should recommend Gowland, the constant use of Gowland, during the spring months.  Mrs Clay has been using it at my recommendation, and you see what it has done for her.  You see how it has carried away her freckles.","[262555, 262867]",Sir Walter Elliot,['Anne Elliot'],Implicit,,"['you', 'you', 'you', 'Mrs Clay', 'you', 'her', 'You', 'her']","[[262565, 262568], [262606, 262609], [262615, 262618], [262734, 262742], [262787, 262790], [262816, 262819], [262822, 262825], [262854, 262857]]","[['Anne Elliot'], ['Anne Elliot'], ['Anne Elliot'], ['Mrs Clay'], ['Anne Elliot'], ['Mrs Clay'], ['Anne Elliot'], ['Mrs Clay']]",X,237,minor,Persuasion,571,571,16,16,26,262555,262867
Q238-0,Elizabeth.,"[265797, 265807]",Anne Elliot,['Lady Russell'],Explicit,Anne presumed however still to smile about it and at last to mention,['Elizabeth'],"[[265797, 265806]]",[['Elizabeth']],X,238,major,Persuasion,575,575,16,16,1,265797,265807
Q239-0,Elizabeth! very well; time will explain.,"[265882, 265922]",Lady Russell,['Anne Elliot'],Explicit,Lady Russell listened and looked and made only this cautious reply,['Elizabeth'],"[[265882, 265891]]",[['Elizabeth']],X,239,minor,Persuasion,575,575,16,16,12,265882,265922
Q240-0,it was an acquaintance worth having;,"[270939, 270975]",Lady Russell,"['Anne Elliot', 'William Walter Elliot']",Implicit,,[],[],[],X,240,minor,Persuasion,583,583,16,16,12,270939,270975
Q241-0,"My idea of good company, Mr Elliot, is the company of clever, well-informed people, who have a great deal of conversation; that is what I call good company.","[271258, 271414]",Anne Elliot,"['Lady Russell', 'William Walter Elliot']",Explicit,Anne smiled and said,['Mr Elliot'],"[[271283, 271292]]",[['William Walter Elliot']],X,241,major,Persuasion,584,584,16,16,1,271258,271414
Q242-0,"You are mistaken,","[271418, 271435]",William Walter Elliot,"['Anne Elliot', 'Lady Russell']",Anaphoric,said he,['You'],"[[271418, 271421]]",[['Anne Elliot']],X,242,minor,Persuasion,585,585,16,16,30,271418,271435
Q242-1,"that is not good company; that is the best.  Good company requires only birth, education, and manners, and with regard to education is not very nice.  Birth and good manners are essential; but a little learning is by no means a dangerous thing in good company; on the contrary, it will do very well.  My cousin Anne shakes her head.  She is not satisfied.  She is fastidious.  My dear cousin","[271454, 271845]",William Walter Elliot,"['Anne Elliot', 'Lady Russell']",Anaphoric,said he,"['My cousin Anne', 'her', 'She', 'She', 'My dear cousin']","[[271755, 271769], [271777, 271780], [271788, 271791], [271811, 271814], [271831, 271845]]","[['Anne Elliot'], ['Anne Elliot'], ['Anne Elliot'], ['Anne Elliot'], ['Anne Elliot']]",X,242,minor,Persuasion,585,585,16,16,30,271454,271845
Q242-2,"you have a better right to be fastidious than almost any other woman I know; but will it answer? Will it make you happy?  Will it not be wiser to accept the society of those good ladies in Laura Place, and enjoy all the advantages of the connexion as far as possible?  You may depend upon it, that they will move in the first set in Bath this winter, and as rank is rank, your being known to be related to them will have its use in fixing your family (our family let me say) in that degree of consideration which we must all wish for.","[271871, 272405]",William Walter Elliot,"['Anne Elliot', 'Lady Russell']",Anaphoric,said he,"['you', 'you', 'You', 'your', 'your family']","[[271871, 271874], [271981, 271984], [272140, 272143], [272243, 272247], [272310, 272321]]","[['Anne Elliot'], ['Anne Elliot'], ['Anne Elliot'], ['Anne Elliot'], ['Anne Elliot', 'Elizabeth', 'Sir Walter Elliot']]",X,242,minor,Persuasion,585,585,16,16,30,271871,272405
Q243-0,"Yes,","[272409, 272413]",Anne Elliot,"['Lady Russell', 'William Walter Elliot']",Explicit,sighed Anne,[],[],[],X,243,major,Persuasion,586,586,16,16,1,272409,272413
Q243-1,"we shall, indeed, be known to be related to them!","[272429, 272478]",Anne Elliot,"['Lady Russell', 'William Walter Elliot']",Explicit,sighed Anne,['we'],"[[272429, 272431]]","[['Anne Elliot', 'William Walter Elliot']]",X,243,major,Persuasion,586,586,16,16,1,272429,272478
Q244-0,I certainly do think there has been by far too much trouble taken to procure the acquaintance.  I suppose,"[272551, 272656]",Anne Elliot,"['Lady Russell', 'William Walter Elliot']",Anaphoric,she added,[],[],[],X,244,major,Persuasion,586,586,16,16,1,272551,272656
Q244-1,"I have more pride than any of you; but I confess it does vex me, that we should be so solicitous to have the relationship acknowledged, which we may be very sure is a matter of perfect indifference to them.","[272669, 272875]",Anne Elliot,"['Lady Russell', 'William Walter Elliot']",Anaphoric,she added,"['you', 'we', 'we']","[[272699, 272702], [272739, 272741], [272811, 272813]]","[['William Walter Elliot'], ['Anne Elliot', 'William Walter Elliot'], ['Anne Elliot', 'William Walter Elliot']]",X,244,major,Persuasion,586,586,16,16,1,272669,272875
Q245-0,"Pardon me, dear cousin, you are unjust in your own claims.  In London, perhaps, in your present quiet style of living, it might be as you say: but in Bath; Sir Walter Elliot and his family will always be worth knowing:  always acceptable as acquaintance.","[272879, 273133]",William Walter Elliot,"['Anne Elliot', 'Lady Russell']",Implicit,,"['dear cousin', 'you', 'your ', 'your', 'you', 'Sir Walter Elliot', 'his']","[[272890, 272901], [272903, 272906], [272921, 272926], [272962, 272966], [273013, 273016], [273035, 273052], [273057, 273060]]","[['Anne Elliot'], ['Anne Elliot'], ['Anne Elliot'], ['Anne Elliot'], ['Anne Elliot'], ['Sir Walter Elliot'], ['Sir Walter Elliot']]",X,245,minor,Persuasion,587,587,16,16,30,272879,273133
Q246-0,"Well,","[273137, 273142]",Anne Elliot,"['Lady Russell', 'William Walter Elliot']",Explicit,said Anne,[],[],[],X,246,major,Persuasion,588,588,16,16,1,273137,273142
Q246-1,"I certainly am proud, too proud to enjoy a welcome which depends so entirely upon place.","[273156, 273244]",Anne Elliot,"['Lady Russell', 'William Walter Elliot']",Explicit,said Anne,[],[],[],X,246,major,Persuasion,588,588,16,16,1,273156,273244
Q247-0,"I love your indignation,","[273248, 273272]",William Walter Elliot,"['Anne Elliot', 'Lady Russell']",Anaphoric,said he,['your'],"[[273255, 273259]]",[['Anne Elliot']],X,247,minor,Persuasion,589,589,16,16,30,273248,273272
Q247-1,"it is very natural.  But here you are in Bath, and the object is to be established here with all the credit and dignity which ought to belong to Sir Walter Elliot.  You talk of being proud; I am called proud, I know, and I shall not wish to believe myself otherwise; for our pride, if investigated, would have the same object, I have no doubt, though the kind may seem a little different.  In one point, I am sure, my dear cousin,","[273284, 273714]",William Walter Elliot,"['Anne Elliot', 'Lady Russell']",Anaphoric,said he,"['you', 'Sir Walter Elliot', 'You', 'our', 'my dear cousin']","[[273314, 273317], [273429, 273446], [273449, 273452], [273555, 273558], [273699, 273713]]","[['Anne Elliot'], ['Sir Walter Elliot'], ['Anne Elliot'], ['Anne Elliot', 'Mr Elliot'], ['Anne Elliot']]",X,247,minor,Persuasion,589,589,16,16,30,273284,273714
Q247-2,"in one point, I am sure, we must feel alike.  We must feel that every addition to your father's society, among his equals or superiors, may be of use in diverting his thoughts from those who are beneath him.","[273790, 273997]",William Walter Elliot,"['Anne Elliot', 'Lady Russell']",Anaphoric,said he,"['we', 'We', 'your', ""father's"", 'his', 'his', 'him']","[[273815, 273817], [273836, 273838], [273872, 273876], [273877, 273885], [273901, 273904], [273953, 273956], [273993, 273996]]","[['Anne Elliot', 'William Walter Elliot'], ['Anne Elliot', 'William Walter Elliot'], ['Anne Elliot'], ['Sir Walter Elliot'], ['Sir Walter Elliot'], ['Sir Walter Elliot'], ['Sir Walter Elliot']]",X,247,minor,Persuasion,589,589,16,16,30,273790,273997
