qID,qText,qSpan,speaker,addressee,qType,refExp,menTexts,menSpans,menEnts,speakerGender,dialogueTurn,speakerType,novel,startParaID,endParaID,startChapID,endChapID,speakerID,startByte,endByte
Q392-1,"but we talked in a pitch-dark room like a coalcellar. There, you would never have guessed that.","[176418, 176513]",Dr. Bull,"['Professor De Worms', 'Gabriel Syme']",Explicit,said Bull,"['we', 'you']","[[176422, 176424], [176479, 176482]]","[['Dr. Bull', 'The Invisible Chief'], ['Gabriel Syme']]",X,392,major,TheManWhoWasThursday,640,640,9,9,7,176418,176513
Q393-0,"I could not have conceived it,","[176517, 176547]",Gabriel Syme,"['Professor De Worms', 'Dr. Bull']",Explicit,said Syme,[],[],[],X,393,major,TheManWhoWasThursday,641,641,9,9,9,176517,176547
Q394-0,"It is indeed a new idea,","[176570, 176594]",Professor De Worms,"['Gabriel Syme', 'Dr. Bull']",Explicit,said the Professor,[],[],[],X,394,major,TheManWhoWasThursday,642,642,9,9,16,176570,176594
Q395-0,"I had already arranged,","[177001, 177024]",Dr. Bull,"['Professor De Worms', 'Gabriel Syme']",Anaphoric,he explained,[],[],[],X,395,major,TheManWhoWasThursday,644,644,9,9,7,177001,177024
Q395-1,"to go to France for my lunch; but I am delighted to have someone to lunch with me. You see, I had to send that beast, the Marquis, over with his bomb, because the President had his eye on me, though God knows how. I'll tell you the story some day. It was perfectly choking. Whenever I tried to slip out of it I saw the President somewhere, smiling out of the bow-window of a club, or taking off his hat to me from the top of an omnibus. I tell you, you can say what you like, that fellow sold himself to the devil; he can be in six places at once.","[177041, 177588]",Dr. Bull,"['Professor De Worms', 'Gabriel Syme']",Anaphoric,he explained,"['You', 'the Marquis', 'his', 'the President', 'his', 'you', 'the President ', 'his', 'you', 'you', 'you', 'he']","[[177124, 177127], [177159, 177170], [177182, 177185], [177200, 177213], [177218, 177221], [177265, 177268], [177356, 177370], [177436, 177439], [177485, 177488], [177490, 177493], [177507, 177510], [177556, 177558]]","[['Professor De Worms', 'Gabriel Syme'], ['Inspector Ratcliffe'], ['Inspector Ratcliffe'], ['The President'], ['The President'], ['Professor De Worms', 'Gabriel Syme'], ['The President'], ['The President'], ['Professor De Worms', 'Gabriel Syme'], ['Professor De Worms', 'Gabriel Syme'], ['Professor De Worms', 'Gabriel Syme'], ['The President']]",X,395,major,TheManWhoWasThursday,644,644,9,9,7,177041,177588
Q396-0,"So you sent the Marquis off, I understand,","[177592, 177634]",Professor De Worms,"['Gabriel Syme', 'Dr. Bull']",Explicit,asked the Professor,"['you', 'the Marquis ']","[[177595, 177598], [177604, 177616]]","[['Dr. Bull'], ['Inspector Ratcliffe']]",X,396,major,TheManWhoWasThursday,645,645,9,9,16,177592,177634
Q396-1,Was it long ago? Shall we be in time to catch him?,"[177658, 177708]",Professor De Worms,"['Gabriel Syme', 'Dr. Bull']",Explicit,asked the Professor,"['we', 'him']","[[177681, 177683], [177704, 177707]]","[['Professor De Worms', 'Dr. Bull', 'Gabriel Syme'], ['Inspector Ratcliffe']]",X,396,major,TheManWhoWasThursday,645,645,9,9,16,177658,177708
Q397-0,"Yes,","[177712, 177716]",Dr. Bull,"['Professor De Worms', 'Gabriel Syme']",Anaphoric,answered the new guide,[],[],[],X,397,major,TheManWhoWasThursday,646,646,9,9,7,177712,177716
Q397-1,I've timed it all. He'll still be at Calais when we arrive.,"[177743, 177802]",Dr. Bull,"['Professor De Worms', 'Gabriel Syme']",Anaphoric,answered the new guide,"[""He'll"", 'we']","[[177762, 177767], [177792, 177794]]","[['Inspector Ratcliffe'], ['Professor De Worms', 'Dr. Bull', 'Gabriel Syme']]",X,397,major,TheManWhoWasThursday,646,646,9,9,7,177743,177802
Q398-0,"But when we do catch him at Calais,","[177806, 177841]",Professor De Worms,"['Gabriel Syme', 'Dr. Bull']",Explicit,said the Professor,"['we', 'him']","[[177815, 177817], [177827, 177830]]","[['Professor De Worms', 'Dr. Bull', 'Gabriel Syme'], ['Inspector Ratcliffe']]",X,398,major,TheManWhoWasThursday,647,647,9,9,16,177806,177841
Q398-1,what are we going to do?,"[177864, 177888]",Professor De Worms,"['Gabriel Syme', 'Dr. Bull']",Explicit,said the Professor,['we'],"[[177873, 177875]]","[['Professor De Worms', 'Dr. Bull', 'Gabriel Syme']]",X,398,major,TheManWhoWasThursday,647,647,9,9,16,177864,177888
Q399-0,"Theoretically, I suppose, we ought to call the police.","[178001, 178055]",Dr. Bull,"['Professor De Worms', 'Gabriel Syme']",Anaphoric,He reflected a little and then said,['we'],"[[178027, 178029]]","[['Professor De Worms', 'Dr. Bull', 'Gabriel Syme']]",X,399,major,TheManWhoWasThursday,649,649,9,9,7,178001,178055
Q400-0,"Not I,","[178059, 178065]",Gabriel Syme,"['Professor De Worms', 'Dr. Bull']",Explicit,said Syme,[],[],[],X,400,major,TheManWhoWasThursday,650,650,9,9,9,178059,178065
Q400-1,"Theoretically I ought to drown myself first. I promised a poor fellow, who was a real modern pessimist, on my word of honour not to tell the police. I'm no hand at casuistry, but I can't break my word to a modern pessimist. It's like breaking one's word to a child.","[178079, 178344]",Gabriel Syme,"['Professor De Worms', 'Dr. Bull']",Explicit,said Syme,['a poor fellow'],"[[178135, 178148]]",[['Gregory']],X,400,major,TheManWhoWasThursday,650,650,9,9,9,178079,178344
Q401-0,"I'm in the same boat,","[178348, 178369]",Professor De Worms,"['Gabriel Syme', 'Dr. Bull']",Explicit,said the Professor,[],[],[],X,401,major,TheManWhoWasThursday,651,651,9,9,16,178348,178369
Q401-1,"I tried to tell the police and I couldn't, because of some silly oath I took. You see, when I was an actor I was a sort of all-round beast. Perjury or treason is the only crime I haven't committed. If I did that I shouldn't know the difference between right and wrong.","[178392, 178660]",Professor De Worms,"['Gabriel Syme', 'Dr. Bull']",Explicit,said the Professor,['You'],"[[178470, 178473]]","[['Gabriel Syme', 'Dr. Bull']]",X,401,major,TheManWhoWasThursday,651,651,9,9,16,178392,178660
Q402-0,"I've been through all that,","[178664, 178691]",Dr. Bull,"['Professor De Worms', 'Gabriel Syme']",Explicit,said Dr Bull,[],[],[],X,402,major,TheManWhoWasThursday,652,652,9,9,7,178664,178691
Q402-1,"and I've made up my mind. I gave my promise to the Secretary you know him, man who smiles upside down. My friends, that man is the most utterly unhappy man that was ever human. It may be his digestion, or his conscience, or his nerves, or his philosophy of the universe, but he's damned, he's in hell! Well, I can't turn on a man like that, and hunt him down. It's like whipping a leper. I may be mad, but that's how I feel; and there's jolly well the end of it.","[178709, 179171]",Dr. Bull,"['Professor De Worms', 'Gabriel Syme']",Explicit,said Dr Bull,"['the Secretary', 'you', 'him', 'that man', 'his', 'his', 'his', 'his', ""he's"", ""he's"", 'him']","[[178756, 178769], [178770, 178773], [178779, 178782], [178824, 178832], [178896, 178899], [178914, 178917], [178933, 178936], [178948, 178951], [178984, 178988], [178997, 179001], [179059, 179062]]","[['The Secretary'], ['Gabriel Syme'], ['The Secretary'], ['The Secretary'], ['The Secretary'], ['The Secretary'], ['The Secretary'], ['The Secretary'], ['The Secretary'], ['The Secretary'], ['The Secretary']]",X,402,major,TheManWhoWasThursday,652,652,9,9,7,178709,179171
Q403-0,"I don't think you're mad,","[179175, 179200]",Gabriel Syme,"['Professor De Worms', 'Dr. Bull']",Explicit,said Syme,"[""you're""]","[[179189, 179195]]",[['Dr. Bull']],X,403,major,TheManWhoWasThursday,653,653,9,9,9,179175,179200
Q403-1,I knew you would decide like that when first you ,"[179214, 179263]",Gabriel Syme,"['Professor De Worms', 'Dr. Bull']",Explicit,said Syme,"['you', 'you']","[[179221, 179224], [179259, 179262]]","[['Dr. Bull'], ['Dr. Bull']]",X,403,major,TheManWhoWasThursday,653,653,9,9,9,179214,179263
Q404-0,Eh?,"[179267, 179270]",Dr. Bull,"['Professor De Worms', 'Gabriel Syme']",Explicit,said Dr Bull,[],[],[],X,404,major,TheManWhoWasThursday,654,654,9,9,7,179267,179270
Q405-0,When first you took off your spectacles.,"[179289, 179329]",Gabriel Syme,"['Professor De Worms', 'Dr. Bull']",Implicit,,"['you', 'your']","[[179300, 179303], [179313, 179317]]","[['Dr. Bull'], ['Dr. Bull']]",X,405,major,TheManWhoWasThursday,655,655,9,9,9,179289,179329
Q406-0,"Well,","[179531, 179536]",Gabriel Syme,"['Professor De Worms', 'Dr. Bull']",Explicit,said Syme,[],[],[],X,406,major,TheManWhoWasThursday,657,657,9,9,9,179531,179536
Q406-1,"it seems that we have all the same kind of morality or immorality, so we had better face the fact that comes of it.","[179550, 179665]",Gabriel Syme,"['Professor De Worms', 'Dr. Bull']",Explicit,said Syme,"['we', 'we']","[[179564, 179566], [179620, 179622]]","[['Professor De Worms', 'Dr. Bull', 'Gabriel Syme'], ['Professor De Worms', 'Dr. Bull', 'Gabriel Syme']]",X,406,major,TheManWhoWasThursday,657,657,9,9,9,179550,179665
Q407-0,"Yes,","[179669, 179673]",Professor De Worms,"['Gabriel Syme', 'Dr. Bull']",Explicit,assented the Professor,[],[],[],X,407,major,TheManWhoWasThursday,658,658,9,9,16,179669,179673
Q407-1,"you're quite right; and we must hurry up, for I can see the Grey Nose standing out from France.","[179700, 179795]",Professor De Worms,"['Gabriel Syme', 'Dr. Bull']",Explicit,assented the Professor,"[""you're"", 'we']","[[179700, 179706], [179724, 179726]]","[['Gabriel Syme'], ['Professor De Worms', 'Dr. Bull', 'Gabriel Syme']]",X,407,major,TheManWhoWasThursday,658,658,9,9,16,179700,179795
Q408-0,"The fact that comes of it,","[179799, 179825]",Gabriel Syme,"['Professor De Worms', 'Dr. Bull']",Explicit,said Syme,[],[],[],X,408,major,TheManWhoWasThursday,659,659,9,9,9,179799,179825
Q408-1,"is this, that we three are alone on this planet. Gogol has gone, God knows where; perhaps the President has smashed him like a fly. On the Council we are three men against three, like the Romans who held the bridge. But we are worse off than that, first because they can appeal to their organization and we cannot appeal to ours, and second because ","[179849, 180198]",Gabriel Syme,"['Professor De Worms', 'Dr. Bull']",Explicit,said Syme,"['we three', 'Gogol', 'the President', 'him', 'we', 'we', 'they', 'their', 'we', 'ours']","[[179863, 179871], [179898, 179903], [179939, 179952], [179965, 179968], [179996, 179998], [180069, 180071], [180111, 180115], [180130, 180135], [180153, 180155], [180173, 180177]]","[['Professor De Worms', 'Dr. Bull', 'Gabriel Syme'], ['Gogol'], ['The President'], ['Gogol'], ['Professor De Worms', 'Dr. Bull', 'Gabriel Syme'], ['Professor De Worms', 'Dr. Bull', 'Gabriel Syme'], ['The Secretary', 'The President', 'Inspector Ratcliffe'], ['The Secretary', 'The President', 'Inspector Ratcliffe'], ['Professor De Worms', 'Dr. Bull', 'Gabriel Syme'], ['Bull', 'Gabriel Syme', 'The Professor']]",X,408,major,TheManWhoWasThursday,659,659,9,9,9,179849,180198
Q409-0,"Because one of those other three men,","[180202, 180239]",Professor De Worms,"['Gabriel Syme', 'Dr. Bull']",Explicit,said the Professor,[],[],[],X,409,major,TheManWhoWasThursday,660,660,9,9,16,180202,180239
Q409-1,is not a man.,"[180262, 180275]",Professor De Worms,"['Gabriel Syme', 'Dr. Bull']",Explicit,said the Professor,[],[],[],X,409,major,TheManWhoWasThursday,660,660,9,9,16,180262,180275
Q410-0,"My idea is this. We must do something to keep the Marquis in Calais till tomorrow midday. I have turned over twenty schemes in my head. We cannot denounce him as a dynamiter; that is agreed. We cannot get him detained on some trivial charge, for we should have to appear; he knows us, and he would smell a rat. We cannot pretend to keep him on anarchist business; he might swallow much in that way, but not the notion of stopping in Calais while the Czar went safely through Paris. We might try to kidnap him, and lock him up ourselves; but he is a well-known man here. He has a whole bodyguard of friends; he is very strong and brave, and the event is doubtful. The only thing I can see to do is actually to take advantage of the very things that are in the Marquis's favour. I am going to profit by the fact that he is a highly respected nobleman. I am going to profit by the fact that he has many friends and moves in the best society.","[180342, 181280]",Gabriel Syme,"['Professor De Worms', 'Dr. Bull']",Anaphoric,he said,"['We', 'the Marquis', 'We', 'We', 'him', 'we', 'he', 'us', 'he', 'We', 'him', 'he', 'We', 'him', 'him', 'he', 'He', 'he', ""the Marquis's"", 'he', 'he']","[[180359, 180361], [180388, 180399], [180478, 180480], [180533, 180535], [180547, 180550], [180588, 180590], [180614, 180616], [180623, 180625], [180631, 180633], [180653, 180655], [180679, 180682], [180706, 180708], [180824, 180826], [180847, 180850], [180861, 180864], [180883, 180885], [180912, 180914], [180949, 180951], [181097, 181110], [181157, 181159], [181230, 181232]]","[['Professor De Worms', 'Dr. Bull', 'Gabriel Syme'], ['Inspector Ratcliffe'], ['Professor De Worms', 'Dr. Bull', 'Gabriel Syme'], ['Professor De Worms', 'Dr. Bull', 'Gabriel Syme'], ['Inspector Ratcliffe'], ['Professor De Worms', 'Dr. Bull', 'Gabriel Syme'], ['Inspector Ratcliffe'], ['Professor De Worms', 'Dr. Bull', 'Gabriel Syme'], ['Inspector Ratcliffe'], ['Professor De Worms', 'Dr. Bull', 'Gabriel Syme'], ['Inspector Ratcliffe'], ['Inspector Ratcliffe'], ['Professor De Worms', 'Dr. Bull', 'Gabriel Syme'], ['Inspector Ratcliffe'], ['Inspector Ratcliffe'], ['Inspector Ratcliffe'], ['Inspector Ratcliffe'], ['Inspector Ratcliffe'], ['Inspector Ratcliffe'], ['Inspector Ratcliffe'], ['Inspector Ratcliffe']]",X,410,major,TheManWhoWasThursday,662,662,9,9,9,180342,181280
Q411-0,What the devil are you talking about?,"[181284, 181321]",Professor De Worms,"['Gabriel Syme', 'Dr. Bull']",Explicit,asked the Professor,['you'],"[[181303, 181306]]",[['Gabriel Syme']],X,411,major,TheManWhoWasThursday,663,663,9,9,16,181284,181321
Q412-0,"The Symes are first mentioned in the fourteenth century,","[181346, 181402]",Gabriel Syme,"['Professor De Worms', 'Dr. Bull']",Explicit,said Syme,[],[],[],X,412,major,TheManWhoWasThursday,664,664,9,9,9,181346,181402
Q412-1,but there is a tradition that one of them rode behind Bruce at Bannockburn. Since 1350 the tree is quite clear.,"[181416, 181527]",Gabriel Syme,"['Professor De Worms', 'Dr. Bull']",Explicit,said Syme,[],[],[],X,412,major,TheManWhoWasThursday,664,664,9,9,9,181416,181527
Q413-0,"He's gone off his head,","[181531, 181554]",Dr. Bull,"['Professor De Worms', 'Gabriel Syme']",Anaphoric,said the little Doctor,"[""He's"", 'his']","[[181531, 181535], [181545, 181548]]","[['Gabriel Syme'], ['Gabriel Syme']]",X,413,major,TheManWhoWasThursday,665,665,9,9,7,181531,181554
Q414-0,"Our bearings,","[181591, 181604]",Gabriel Syme,"['Professor De Worms', 'Dr. Bull']",Explicit,continued Syme,['Our'],"[[181591, 181594]]",[['Gabriel Syme']],X,414,major,TheManWhoWasThursday,666,666,9,9,9,181591,181604
Q414-1,are  argent a chevron gules charged with three cross crosslets of the field.' The motto varies.,"[181630, 181725]",Gabriel Syme,"['Professor De Worms', 'Dr. Bull']",Explicit,continued Syme,[],[],[],X,414,major,TheManWhoWasThursday,666,666,9,9,9,181630,181725
Q415-0,"We are just inshore,","[181782, 181802]",Professor De Worms,"['Gabriel Syme', 'Dr. Bull']",Anaphoric,he said,['We'],"[[181782, 181784]]","[['Professor De Worms', 'Dr. Bull', 'Gabriel Syme']]",X,415,major,TheManWhoWasThursday,668,668,9,9,16,181782,181802
Q415-1,Are you seasick or joking in the wrong place?,"[181814, 181859]",Professor De Worms,"['Gabriel Syme', 'Dr. Bull']",Anaphoric,he said,['you'],"[[181818, 181821]]",[['Gabriel Syme']],X,415,major,TheManWhoWasThursday,668,668,9,9,16,181814,181859
Q416-0,"My remarks are almost painfully practical,","[181863, 181905]",Gabriel Syme,"['Professor De Worms', 'Dr. Bull']",Explicit,answered Syme,[],[],[],X,416,major,TheManWhoWasThursday,669,669,9,9,9,181863,181905
Q416-1,"The house of St. Eustache also is very ancient. The Marquis cannot deny that he is a gentleman. He cannot deny that I am a gentleman. And in order to put the matter of my social position quite beyond a doubt, I propose at the earliest opportunity to knock his hat off. But here we are in the harbour.","[181947, 182247]",Gabriel Syme,"['Professor De Worms', 'Dr. Bull']",Explicit,answered Syme,"['The Marquis', 'he', 'He', 'his', 'we']","[[181995, 182006], [182024, 182026], [182043, 182045], [182203, 182206], [182225, 182227]]","[['Inspector Ratcliffe'], ['Inspector Ratcliffe'], ['Inspector Ratcliffe'], ['Inspector Ratcliffe'], ['Professor De Worms', 'Dr. Bull', 'Gabriel Syme']]",X,416,major,TheManWhoWasThursday,669,669,9,9,9,181947,182247
Q417-0,"I shall approach. Before taking off his hat, I shall take off my own. I shall say,","[183680, 183762]",Gabriel Syme,"['Professor De Worms', 'Dr. Bull']",Implicit,,['his'],"[[183716, 183719]]",[['Inspector Ratcliffe']],X,417,major,TheManWhoWasThursday,673,673,10,10,9,183680,183762
Q418-0,"He will say,","[183807, 183819]",Gabriel Syme,"['Professor De Worms', 'Dr. Bull']",Implicit,,['He'],"[[183807, 183809]]",[['Inspector Ratcliffe']],X,418,major,TheManWhoWasThursday,673,673,10,10,9,183807,183819
Q419-0,"He will say in the most exquisite French, ","[183858, 183900]",Gabriel Syme,"['Professor De Worms', 'Dr. Bull']",Implicit,,['He'],"[[183858, 183860]]",[['Inspector Ratcliffe']],X,419,major,TheManWhoWasThursday,673,673,10,10,9,183858,183900
Q420-0,"I shall reply in the most exquisite Cockney,","[183915, 183959]",Gabriel Syme,"['Professor De Worms', 'Dr. Bull']",Implicit,,[],[],[],X,420,major,TheManWhoWasThursday,673,673,10,10,9,183915,183959
Q421-0,"Oh, shut it,","[183984, 183996]",Dr. Bull,"['Professor De Worms', 'Gabriel Syme']",Anaphoric,said the man in spectacles,[],[],[],X,421,major,TheManWhoWasThursday,674,674,10,10,7,183984,183996
Q421-1,"Pull yourself together, and chuck away that bit of paper. What are you really going to do?","[184027, 184117]",Dr. Bull,"['Professor De Worms', 'Gabriel Syme']",Anaphoric,said the man in spectacles,['you'],"[[184094, 184097]]",[['Gabriel Syme']],X,421,major,TheManWhoWasThursday,674,674,10,10,7,184027,184117
Q422-0,"But it was a lovely catechism,","[184121, 184151]",Gabriel Syme,"['Professor De Worms', 'Dr. Bull']",Explicit,said Syme,[],[],[],X,422,major,TheManWhoWasThursday,675,675,10,10,9,184121,184151
Q422-1,"Do let me read it you. It has only forty-three questions and answers, and some of the Marquis's answers are wonderfully witty. I like to be just to my enemy.","[184178, 184335]",Gabriel Syme,"['Professor De Worms', 'Dr. Bull']",Explicit,said Syme,"['you', 'the Marquis']","[[184196, 184199], [184260, 184271]]","[['Dr. Bull'], ['Inspector Ratcliffe']]",X,422,major,TheManWhoWasThursday,675,675,10,10,9,184178,184335
Q423-0,But what's the good of it all?,"[184339, 184369]",Dr. Bull,"['Professor De Worms', 'Gabriel Syme']",Explicit,asked Dr Bull,[],[],[],X,423,major,TheManWhoWasThursday,676,676,10,10,7,184339,184369
Q424-0,"It leads up to my challenge, don't you see,","[184405, 184448]",Gabriel Syme,"['Professor De Worms', 'Dr. Bull']",Explicit,said Syme,['you'],"[[184440, 184443]]",[['Dr. Bull']],X,424,major,TheManWhoWasThursday,677,677,10,10,9,184405,184448
Q424-1,"When the Marquis has given the thirty-ninth reply, which runs ","[184471, 184533]",Gabriel Syme,"['Professor De Worms', 'Dr. Bull']",Explicit,said Syme,['the Marquis'],"[[184476, 184487]]",[['Inspector Ratcliffe']],X,424,major,TheManWhoWasThursday,677,677,10,10,9,184471,184533
Q425-0,"Has it by any chance occurred to you,","[184537, 184574]",Professor De Worms,"['Gabriel Syme', 'Dr. Bull']",Explicit,asked the Professor,['you'],"[[184570, 184573]]",[['Gabriel Syme']],X,425,major,TheManWhoWasThursday,678,678,10,10,16,184537,184574
Q425-1,"that the Marquis may not say all the forty-three things you have put down for him? In that case, I understand, your own epigrams may appear somewhat more forced.","[184627, 184788]",Professor De Worms,"['Gabriel Syme', 'Dr. Bull']",Explicit,asked the Professor,"['the Marquis', 'you', 'him', 'your']","[[184632, 184643], [184683, 184686], [184705, 184708], [184738, 184742]]","[['Inspector Ratcliffe'], ['Gabriel Syme'], ['Inspector Ratcliffe'], ['Gabriel Syme']]",X,425,major,TheManWhoWasThursday,678,678,10,10,16,184627,184788
Q426-0,"Why, how true that is,","[184836, 184858]",Gabriel Syme,"['Professor De Worms', 'Dr. Bull']",Anaphoric,he said,[],[],[],X,426,major,TheManWhoWasThursday,680,680,10,10,9,184836,184858
Q426-1,"and I never thought of it. Sir, you have an intellect beyond the common. You will make a name.","[184870, 184964]",Gabriel Syme,"['Professor De Worms', 'Dr. Bull']",Anaphoric,he said,"['Sir', 'you', 'You']","[[184897, 184900], [184902, 184905], [184943, 184946]]","[['Professor De Worms'], ['Professor De Worms'], ['Professor De Worms']]",X,426,major,TheManWhoWasThursday,680,680,10,10,9,184870,184964
Q427-0,"Oh, you're as drunk as an owl!","[184968, 184998]",Dr. Bull,"['Professor De Worms', 'Gabriel Syme']",Explicit,said the Doctor,"[""you're""]","[[184972, 184978]]",[['Gabriel Syme']],X,427,major,TheManWhoWasThursday,681,681,10,10,7,184968,184998
Q428-0,"It only remains,","[185019, 185035]",Gabriel Syme,"['Professor De Worms', 'Dr. Bull']",Explicit,continued Syme,[],[],[],X,428,major,TheManWhoWasThursday,682,682,10,10,9,185019,185035
Q428-1,"to adopt some other method of breaking the ice (if I may so express it) between myself and the man I wish to kill. And since the course of a dialogue cannot be predicted by one of its parties alone (as you have pointed out with such recondite acumen), the only thing to be done, I suppose, is for the one party, as far as possible, to do all the dialogue by himself. And so I will, by George!","[185072, 185464]",Gabriel Syme,"['Professor De Worms', 'Dr. Bull']",Explicit,continued Syme,[],[],[],X,428,major,TheManWhoWasThursday,682,682,10,10,9,185072,185464
Q429-0,Are you going to address the meeting?,"[186732, 186769]",Professor De Worms,"['Gabriel Syme', 'Dr. Bull']",Explicit,asked the Professor,['you'],"[[186736, 186739]]",[['Gabriel Syme']],X,429,major,TheManWhoWasThursday,684,684,10,10,16,186732,186769
Q430-0,"I am,","[186900, 186905]",Gabriel Syme,"['Professor De Worms', 'Dr. Bull']",Anaphoric,he said,[],[],[],X,430,major,TheManWhoWasThursday,686,686,10,10,9,186900,186905
Q430-1,"that meeting. That meeting displeases me. I am going to pull that meeting's great ugly, mahogany-coloured nose.","[186968, 187079]",Gabriel Syme,"['Professor De Worms', 'Dr. Bull']",Anaphoric,he said,[],[],[],X,430,major,TheManWhoWasThursday,686,686,10,10,9,186968,187079
Q431-0,"You are Mr. Syme, I think,","[187228, 187254]",Inspector Ratcliffe,"['Colonel Ducroix', 'Gabriel Syme', 'The Second Gentleman']",Anaphoric,he said,"['You', 'Mr. Syme']","[[187228, 187231], [187236, 187244]]","[['Gabriel Syme'], ['Gabriel Syme']]",X,431,major,TheManWhoWasThursday,688,688,10,10,12,187228,187254
Q432-0,"And you are the Marquis de Saint Eustache,","[187280, 187322]",Gabriel Syme,"['Colonel Ducroix', 'Inspector Ratcliffe', 'The Second Gentleman']",Anaphoric,he said,"['you', 'the Marquis de Saint Eustache']","[[187284, 187287], [187292, 187321]]","[['Inspector Ratcliffe'], ['Inspector Ratcliffe']]",X,432,major,TheManWhoWasThursday,690,690,10,10,9,187280,187322
Q432-1,Permit me to pull your nose.,"[187345, 187373]",Gabriel Syme,"['Colonel Ducroix', 'Inspector Ratcliffe', 'The Second Gentleman']",Anaphoric,he said,['your'],"[[187363, 187367]]",[['Inspector Ratcliffe']],X,432,major,TheManWhoWasThursday,690,690,10,10,9,187345,187373
Q433-0,This man has insulted me!,"[187519, 187544]",Gabriel Syme,"['Colonel Ducroix', 'Inspector Ratcliffe', 'The Second Gentleman']",Explicit,said Syme,['This man'],"[[187519, 187527]]",[['Inspector Ratcliffe']],X,433,major,TheManWhoWasThursday,692,692,10,10,9,187519,187544
Q434-0,Insulted you?,"[187589, 187602]",Colonel Ducroix,"['Inspector Ratcliffe', 'Gabriel Syme', 'The Second Gentleman']",Explicit,cried the gentleman with the red rosette,['you'],"[[187598, 187601]]",[['Gabriel Syme']],X,434,minor,TheManWhoWasThursday,693,693,10,10,5,187589,187602
Q434-1,when?,"[187647, 187652]",Colonel Ducroix,"['Inspector Ratcliffe', 'Gabriel Syme', 'The Second Gentleman']",Explicit,cried the gentleman with the red rosette,[],[],[],X,434,minor,TheManWhoWasThursday,693,693,10,10,5,187647,187652
Q435-0,"Oh, just now,","[187656, 187669]",Gabriel Syme,"['Colonel Ducroix', 'Inspector Ratcliffe', 'The Second Gentleman']",Explicit,said Syme,[],[],[],X,435,major,TheManWhoWasThursday,694,694,10,10,9,187656,187669
Q435-1,He insulted my mother.,"[187694, 187716]",Gabriel Syme,"['Colonel Ducroix', 'Inspector Ratcliffe', 'The Second Gentleman']",Explicit,said Syme,['He'],"[[187694, 187696]]",[['Inspector Ratcliffe']],X,435,major,TheManWhoWasThursday,694,694,10,10,9,187694,187716
Q436-0,Insulted your mother!,"[187720, 187741]",Colonel Ducroix,"['Inspector Ratcliffe', 'Gabriel Syme', 'The Second Gentleman']",,exclaimed the gentleman,['your'],"[[187729, 187733]]",[['Gabriel Syme']],X,436,minor,TheManWhoWasThursday,695,695,10,10,5,187720,187741
Q437-0,"Well, anyhow,","[187784, 187797]",Gabriel Syme,"['Colonel Ducroix', 'Inspector Ratcliffe', 'The Second Gentleman']",Explicit,said Syme,[],[],[],X,437,major,TheManWhoWasThursday,696,696,10,10,9,187784,187797
Q437-1,my aunt.,"[187830, 187838]",Gabriel Syme,"['Colonel Ducroix', 'Inspector Ratcliffe', 'The Second Gentleman']",Explicit,said Syme,[],[],[],X,437,major,TheManWhoWasThursday,696,696,10,10,9,187830,187838
Q438-0,But how can the Marquis have insulted your aunt just now?,"[187842, 187899]",The Second Gentleman,"['Colonel Ducroix', 'Inspector Ratcliffe', 'Gabriel Syme']",Explicit,said the second gentleman,"['the Marquis', 'your']","[[187854, 187865], [187880, 187884]]","[['Inspector Ratcliffe'], ['Gabriel Syme']]",X,438,minor,TheManWhoWasThursday,697,697,10,10,23,187842,187899
