qID,qText,qSpan,speaker,addressee,qType,refExp,menTexts,menSpans,menEnts,speakerGender,dialogueTurn,speakerType,novel,startParaID,endParaID,startChapID,endChapID,speakerID,startByte,endByte
Q160-1,Is this undenominational education?,"[63628, 63663]",Gabriel Syme,['The Policeman'],Explicit,said Syme,[],[],[],X,160,major,TheManWhoWasThursday,256,256,4,4,9,63628,63663
Q161-0,"No,","[63667, 63670]",The Policeman,['Gabriel Syme'],Explicit,said the policeman,[],[],[],X,161,minor,TheManWhoWasThursday,257,257,4,4,22,63667,63670
Q161-1,"I never had any of those advantages. The Board Schools came after my time. What education I had was very rough and old-fashioned, I am afraid.","[63699, 63841]",The Policeman,['Gabriel Syme'],Explicit,said the policeman,[],[],[],X,161,minor,TheManWhoWasThursday,257,257,4,4,22,63699,63841
Q162-0,Where did you have it?,"[63845, 63867]",Gabriel Syme,['The Policeman'],Explicit,asked Syme,['you'],"[[63855, 63858]]",[['The Policeman']],X,162,major,TheManWhoWasThursday,258,258,4,4,9,63845,63867
Q163-0,"Oh, at Harrow,","[63894, 63908]",The Policeman,['Gabriel Syme'],Explicit,said the policeman,[],[],[],X,163,minor,TheManWhoWasThursday,259,259,4,4,22,63894,63908
Q164-0,"But, good Lord, man,","[64065, 64085]",Gabriel Syme,['The Policeman'],Anaphoric,he said,['man'],"[[64081, 64084]]",[['The Policeman']],X,164,major,TheManWhoWasThursday,261,261,4,4,9,64065,64085
Q164-1,you oughtn't to be a policeman!,"[64097, 64128]",Gabriel Syme,['The Policeman'],Anaphoric,he said,['you'],"[[64097, 64100]]",[['The Policeman']],X,164,major,TheManWhoWasThursday,261,261,4,4,9,64097,64128
Q165-0,"I know,","[64174, 64181]",The Policeman,['Gabriel Syme'],Anaphoric,he said,[],[],[],X,165,minor,TheManWhoWasThursday,263,263,4,4,22,64174,64181
Q165-1,I know I am not worthy.,"[64202, 64225]",The Policeman,['Gabriel Syme'],Anaphoric,he said,[],[],[],X,165,minor,TheManWhoWasThursday,263,263,4,4,22,64202,64225
Q166-0,But why did you join the police?,"[64229, 64261]",Gabriel Syme,['The Policeman'],Explicit,asked Syme,['you'],"[[64241, 64244]]",[['The Policeman']],X,166,major,TheManWhoWasThursday,264,264,4,4,9,64229,64261
Q167-0,"For much the same reason that you abused the police,","[64297, 64349]",The Policeman,['Gabriel Syme'],Anaphoric,replied the other,['you'],"[[64327, 64330]]",[['Gabriel Syme']],X,167,minor,TheManWhoWasThursday,265,265,4,4,22,64297,64349
Q167-1,"I found that there was a special opening in the service for those whose fears for humanity were concerned rather with the aberrations of the scientific intellect than with the normal and excusable, though excessive, outbreaks of the human will. I trust I make myself clear.","[64371, 64644]",The Policeman,['Gabriel Syme'],Anaphoric,replied the other,[],[],[],X,167,minor,TheManWhoWasThursday,265,265,4,4,22,64371,64644
Q168-0,"If you mean that you make your opinion clear,","[64648, 64693]",Gabriel Syme,['The Policeman'],Explicit,said Syme,"['you', 'you', 'your']","[[64651, 64654], [64665, 64668], [64674, 64678]]","[['The Policeman'], ['The Policeman'], ['The Policeman']]",X,168,major,TheManWhoWasThursday,266,266,4,4,9,64648,64693
Q168-1,"I suppose you do. But as for making yourself clear, it is the last thing you do. How comes a man like you to be talking philosophy in a blue helmet on the Thames embankment?","[64707, 64880]",Gabriel Syme,['The Policeman'],Explicit,said Syme,"['you', 'you', 'you']","[[64717, 64720], [64780, 64783], [64809, 64812]]","[['The Policeman'], ['The Policeman'], ['The Policeman']]",X,168,major,TheManWhoWasThursday,266,266,4,4,9,64707,64880
Q169-0,"You have evidently not heard of the latest development in our police system,","[64884, 64960]",The Policeman,['Gabriel Syme'],Anaphoric,replied the other,['You'],"[[64884, 64887]]",[['Gabriel Syme']],X,169,minor,TheManWhoWasThursday,267,267,4,4,22,64884,64960
Q169-1,"I am not surprised at it. We are keeping it rather dark from the educated class, because that class contains most of our enemies. But you seem to be exactly in the right frame of mind. I think you might almost join us.","[64982, 65200]",The Policeman,['Gabriel Syme'],Anaphoric,replied the other,"['We', 'you', 'you', 'us']","[[65008, 65010], [65116, 65119], [65175, 65178], [65197, 65199]]","[['The Policeman'], ['Gabriel Syme'], ['Gabriel Syme'], ['The Policeman']]",X,169,minor,TheManWhoWasThursday,267,267,4,4,22,64982,65200
Q170-0,Join you in what?,"[65204, 65221]",Gabriel Syme,['The Policeman'],Explicit,asked Syme,['you'],"[[65209, 65212]]",[['The Policeman']],X,170,major,TheManWhoWasThursday,268,268,4,4,9,65204,65221
Q171-0,"I will tell you,","[65237, 65253]",The Policeman,['Gabriel Syme'],Explicit,said the policeman,['you'],"[[65249, 65252]]",[['Gabriel Syme']],X,171,minor,TheManWhoWasThursday,269,269,4,4,22,65237,65253
Q171-1,"This is the situation: The head of one of our departments, one of the most celebrated detectives in Europe, has long been of opinion that a purely intellectual conspiracy would soon threaten the very existence of civilisation. He is certain that the scientific and artistic worlds are silently bound in a crusade against the Family and the State. He has, therefore, formed a special corps of policemen, policemen who are also philosophers. It is their business to watch the beginnings of this conspiracy, not merely in a criminal but in a controversial sense. I am a democrat myself, and I am fully aware of the value of the ordinary man in matters of ordinary valour or virtue. But it would obviously be undesirable to employ the common policeman in an investigation which is also a heresy hunt.","[65283, 66079]",The Policeman,['Gabriel Syme'],Explicit,said the policeman,"['He', 'He']","[[65510, 65512], [65630, 65632]]","[['The Invisible Chief'], ['The Invisible Chief']]",X,171,minor,TheManWhoWasThursday,269,269,4,4,22,65283,66079
Q172-0,"What do you do, then?","[66138, 66159]",Gabriel Syme,['The Policeman'],Anaphoric,he said,['you'],"[[66146, 66149]]",[['The Policeman']],X,172,major,TheManWhoWasThursday,271,271,4,4,9,66138,66159
Q173-0,"The work of the philosophical policeman,","[66172, 66212]",The Policeman,['Gabriel Syme'],Anaphoric,replied the man in blue,[],[],[],X,173,minor,TheManWhoWasThursday,272,272,4,4,22,66172,66212
Q173-1,"is at once bolder and more subtle than that of the ordinary detective. The ordinary detective goes to pot-houses to arrest thieves; we go to artistic tea-parties to detect pessimists. The ordinary detective discovers from a ledger or a diary that a crime has been committed. We discover from a book of sonnets that a crime will be committed. We have to trace the origin of those dreadful thoughts that drive men on at last to intellectual fanaticism and intellectual crime. We were only just in time to prevent the assassination at Hartlepool, and that was entirely due to the fact that our Mr. Wilks (a smart young fellow) thoroughly understood a triolet.","[66240, 66896]",The Policeman,['Gabriel Syme'],Anaphoric,replied the man in blue,"['we', 'We', 'We', 'We']","[[66372, 66374], [66515, 66517], [66582, 66584], [66714, 66716]]","[['The Policeman'], ['The Policeman'], ['The Policeman'], ['The Policeman']]",X,173,minor,TheManWhoWasThursday,272,272,4,4,22,66240,66896
Q174-0,"Do you mean,","[66900, 66912]",Gabriel Syme,['The Policeman'],Explicit,asked Syme,['you'],"[[66903, 66906]]",[['The Policeman']],X,174,major,TheManWhoWasThursday,273,273,4,4,9,66900,66912
Q174-1,that there is really as much connection between crime and the modern intellect as all that?,"[66927, 67018]",Gabriel Syme,['The Policeman'],Explicit,asked Syme,[],[],[],X,174,major,TheManWhoWasThursday,273,273,4,4,9,66927,67018
Q175-0,"You are not sufficiently democratic,","[67022, 67058]",The Policeman,['Gabriel Syme'],Explicit,answered the policeman,['You'],"[[67022, 67025]]",[['Gabriel Syme']],X,175,minor,TheManWhoWasThursday,274,274,4,4,22,67022,67058
Q175-1,"but you were right when you said just now that our ordinary treatment of the poor criminal was a pretty brutal business. I tell you I am sometimes sick of my trade when I see how perpetually it means merely a war upon the ignorant and the desperate. But this new movement of ours is a very different affair. We deny the snobbish English assumption that the uneducated are the dangerous criminals. We remember the Roman Emperors. We remember the great poisoning princes of the Renaissance. We say that the dangerous criminal is the educated criminal. We say that the most dangerous criminal now is the entirely lawless modern philosopher. Compared to him, burglars and bigamists are essentially moral men; my heart goes out to them. They accept the essential ideal of man; they merely seek it wrongly. Thieves respect property. They merely wish the property to become their property that they may more perfectly respect it. But philosophers dislike property as property; they wish to destroy the very idea of personal possession. Bigamists respect marriage, or they would not go through the highly ceremonial and even ritualistic formality of bigamy. But philosophers despise marriage as marriage. Murderers respect human life; they merely wish to attain a greater fulness of human life in themselves by the sacrifice of what seems to them to be lesser lives. But philosophers hate life itself, their own as much as other people's.","[67085, 68515]",The Policeman,['Gabriel Syme'],Explicit,answered the policeman,"['you', 'you', 'you', 'We', 'We', 'We', 'We', 'We']","[[67089, 67092], [67109, 67112], [67213, 67216], [67393, 67395], [67482, 67484], [67514, 67516], [67574, 67576], [67635, 67637]]","[['Gabriel Syme'], ['Gabriel Syme'], ['Gabriel Syme'], ['The Policeman'], ['The Policeman'], ['The Policeman'], ['The Policeman'], ['The Policeman']]",X,175,minor,TheManWhoWasThursday,274,274,4,4,22,67085,68515
Q176-0,"How true that is,","[68552, 68569]",Gabriel Syme,['The Policeman'],Anaphoric,he cried,[],[],[],X,176,major,TheManWhoWasThursday,276,276,4,4,9,68552,68569
Q176-1,"I have felt it from my boyhood, but never could state the verbal antithesis. The common criminal is a bad man, but at least he is, as it were, a conditional good man. He says that if only a certain obstacle be removed say a wealthy uncle he is then prepared to accept the universe and to praise God. He is a reformer, but not an anarchist. He wishes to cleanse the edifice, but not to destroy it. But the evil philosopher is not trying to alter things, but to annihilate them. Yes, the modern world has retained all those parts of police work which are really oppressive and ignominious, the harrying of the poor, the spying upon the unfortunate. It has given up its more dignified work, the punishment of powerful traitors in the State and powerful heresiarchs in the Church. The moderns say we must not punish heretics. My only doubt is whether we have a right to punish anybody else.","[68582, 69468]",Gabriel Syme,['The Policeman'],Anaphoric,he cried,['we'],"[[69429, 69431]]","[['The Policeman', 'Gabriel Syme']]",X,176,major,TheManWhoWasThursday,276,276,4,4,9,68582,69468
Q177-0,But this is absurd!,"[69472, 69491]",The Policeman,['Gabriel Syme'],Explicit,cried the policeman,[],[],[],X,177,minor,TheManWhoWasThursday,277,277,4,4,22,69472,69491
Q177-1,"but it is intolerable! I don't know what you're doing, but you're wasting your life. You must, you shall, join our special army against anarchy. Their armies are on our frontiers. Their bolt is ready to fall. A moment more, and you may lose the glory of working with us, perhaps the glory of dying with the last heroes of the world.","[69600, 69932]",The Policeman,['Gabriel Syme'],Explicit,cried the policeman,"[""you're"", ""you're"", 'your', 'You', 'you', 'you', 'us']","[[69641, 69647], [69659, 69665], [69674, 69678], [69685, 69688], [69695, 69698], [69828, 69831], [69867, 69869]]","[['Gabriel Syme'], ['Gabriel Syme'], ['Gabriel Syme'], ['Gabriel Syme'], ['Gabriel Syme'], ['Gabriel Syme'], ['The Policeman']]",X,177,minor,TheManWhoWasThursday,277,277,4,4,22,69600,69932
Q178-0,"It is a chance not to be missed, certainly,","[69936, 69979]",Gabriel Syme,['The Policeman'],Explicit,assented Syme,[],[],[],X,178,major,TheManWhoWasThursday,278,278,4,4,9,69936,69979
Q178-1,"but still I do not quite understand. I know as well as anybody that the modern world is full of lawless little men and mad little movements. But, beastly as they are, they generally have the one merit of disagreeing with each other. How can you talk of their leading one army or hurling one bolt. What is this anarchy?","[69997, 70315]",Gabriel Syme,['The Policeman'],Explicit,assented Syme,['you'],"[[70238, 70241]]",[['The Policeman']],X,178,major,TheManWhoWasThursday,278,278,4,4,9,69997,70315
Q179-0,"Do not confuse it,","[70319, 70337]",The Policeman,['Gabriel Syme'],Anaphoric,replied the constable,[],[],[],X,179,minor,TheManWhoWasThursday,279,279,4,4,22,70319,70337
Q179-1,"with those chance dynamite outbreaks from Russia or from Ireland, which are really the outbreaks of oppressed, if mistaken, men. This is a vast philosophic movement, consisting of an outer and an inner ring. You might even call the outer ring the laity and the inner ring the priesthood. I prefer to call the outer ring the innocent section, the inner ring the supremely guilty section. The outer ring the main mass of their supporters are merely anarchists; that is, men who believe that rules and formulas have destroyed human happiness. They believe that all the evil results of human crime are the results of the system that has called it crime. They do not believe that the crime creates the punishment. They believe that the punishment has created the crime. They believe that if a man seduced seven women he would naturally walk away as blameless as the flowers of spring. They believe that if a man picked a pocket he would naturally feel exquisitely good. These I call the innocent section.","[70363, 71362]",The Policeman,['Gabriel Syme'],Anaphoric,replied the constable,['You'],"[[70571, 70574]]",[['Gabriel Syme']],X,179,minor,TheManWhoWasThursday,279,279,4,4,22,70363,71362
Q180-0,Oh!,"[71366, 71369]",Gabriel Syme,['The Policeman'],Explicit,said Syme,[],[],[],X,180,major,TheManWhoWasThursday,280,280,4,4,9,71366,71369
Q181-0,"Naturally, therefore, these people talk about  a happy time coming';  the paradise of the future';  mankind freed from the bondage of vice and the bondage of virtue,' and so on. And so also the men of the inner circle speak the sacred priesthood. They also speak to applauding crowds of the happiness of the future, and of mankind freed at last. But in their mouths","[71384, 71749]",The Policeman,['Gabriel Syme'],Implicit,,[],[],[],X,181,minor,TheManWhoWasThursday,281,281,4,4,22,71384,71749
Q182-0,"in their mouths these happy phrases have a horrible meaning. They are under no illusions; they are too intellectual to think that man upon this earth can ever be quite free of original sin and the struggle. And they mean death. When they say that mankind shall be free at last, they mean that mankind shall commit suicide. When they talk of a paradise without right or wrong, they mean the grave.","[71788, 72184]",The Policeman,['Gabriel Syme'],Implicit,,[],[],[],X,182,minor,TheManWhoWasThursday,281,281,4,4,22,71788,72184
Q183-0,"They have but two objects, to destroy first humanity and then themselves. That is why they throw bombs instead of firing pistols. The innocent rank and file are disappointed because the bomb has not killed the king; but the high-priesthood are happy because it has killed somebody.","[72188, 72469]",The Policeman,['Gabriel Syme'],Implicit,,[],[],[],X,183,minor,TheManWhoWasThursday,282,282,4,4,22,72188,72469
Q184-0,How can I join you?,"[72473, 72492]",Gabriel Syme,['The Policeman'],Explicit,asked Syme,['you'],"[[72488, 72491]]",[['The Policeman']],X,184,major,TheManWhoWasThursday,283,283,4,4,9,72473,72492
Q185-0,"I know for a fact that there is a vacancy at the moment,","[72532, 72588]",The Policeman,['Gabriel Syme'],Explicit,said the policeman,[],[],[],X,185,minor,TheManWhoWasThursday,284,284,4,4,22,72532,72588
Q185-1,"as I have the honour to be somewhat in the confidence of the chief of whom I have spoken. You should really come and see him. Or rather, I should not say see him, nobody ever sees him; but you can talk to him if you like.","[72611, 72832]",The Policeman,['Gabriel Syme'],Explicit,said the policeman,"['the chief', 'You', 'him', 'him', 'him', 'him', 'you']","[[72668, 72677], [72701, 72704], [72732, 72735], [72769, 72772], [72791, 72794], [72816, 72819], [72823, 72826]]","[['The Invisible Chief'], ['Gabriel Syme'], ['The Invisible Chief'], ['The Invisible Chief'], ['The Invisible Chief'], ['The Invisible Chief'], ['Gabriel Syme']]",X,185,minor,TheManWhoWasThursday,284,284,4,4,22,72611,72832
Q186-0,Telephone?,"[72836, 72846]",Gabriel Syme,['The Policeman'],Explicit,inquired Syme,[],[],[],X,186,major,TheManWhoWasThursday,285,285,4,4,9,72836,72846
Q187-0,"No,","[72880, 72883]",The Policeman,['Gabriel Syme'],Explicit,said the policeman,[],[],[],X,187,minor,TheManWhoWasThursday,286,286,4,4,22,72880,72883
Q187-1,he has a fancy for always sitting in a pitch-dark room. He says it makes his thoughts brighter. Do come along.,"[72915, 73025]",The Policeman,['Gabriel Syme'],Explicit,said the policeman,"['he', 'He', 'his']","[[72915, 72917], [72971, 72973], [72988, 72991]]","[['The Invisible Chief'], ['The Invisible Chief'], ['The Invisible Chief']]",X,187,minor,TheManWhoWasThursday,286,286,4,4,22,72915,73025
Q188-0,Are you the new recruit?,"[73494, 73518]",The Invisible Chief,"['Gabriel Syme', 'The Policeman']",Anaphoric,asked a heavy voice,['you'],"[[73498, 73501]]",[['Gabriel Syme']],X,188,minor,TheManWhoWasThursday,288,288,4,4,19,73494,73518
Q189-0,Are you the new recruit?,"[73745, 73769]",The Invisible Chief,"['Gabriel Syme', 'The Policeman']",Anaphoric,said the invisible chief,['you'],"[[73749, 73752]]",[['Gabriel Syme']],X,189,minor,TheManWhoWasThursday,290,290,4,4,19,73745,73769
Q189-1,All right. You are engaged.,"[73837, 73864]",The Invisible Chief,"['Gabriel Syme', 'The Policeman']",Anaphoric,said the invisible chief,['You'],"[[73848, 73851]]",[['Gabriel Syme']],X,189,minor,TheManWhoWasThursday,290,290,4,4,19,73837,73864
Q190-0,"I really have no experience,","[73954, 73982]",Gabriel Syme,"['The Policeman', 'The Invisible Chief']",Anaphoric,he began,[],[],[],X,190,major,TheManWhoWasThursday,292,292,4,4,9,73954,73982
Q191-0,"No one has any experience,","[73996, 74022]",The Invisible Chief,"['Gabriel Syme', 'The Policeman']",Anaphoric,said the other,[],[],[],X,191,minor,TheManWhoWasThursday,293,293,4,4,19,73996,74022
Q191-1,of the Battle of Armageddon.,"[74041, 74069]",The Invisible Chief,"['Gabriel Syme', 'The Policeman']",Anaphoric,said the other,[],[],[],X,191,minor,TheManWhoWasThursday,293,293,4,4,19,74041,74069
Q192-0,But I am really unfit ,"[74073, 74095]",Gabriel Syme,"['The Policeman', 'The Invisible Chief']",Implicit,,[],[],[],X,192,major,TheManWhoWasThursday,294,294,4,4,9,74073,74095
Q193-0,"You are willing, that is enough,","[74099, 74131]",The Invisible Chief,"['Gabriel Syme', 'The Policeman']",Explicit,said the unknown,['You'],"[[74099, 74102]]",[['Gabriel Syme']],X,193,minor,TheManWhoWasThursday,295,295,4,4,19,74099,74131
Q194-0,"Well, really,","[74153, 74166]",Gabriel Syme,"['The Policeman', 'The Invisible Chief']",Explicit,said Syme,[],[],[],X,194,major,TheManWhoWasThursday,296,296,4,4,9,74153,74166
Q194-1,I don't know any profession of which mere willingness is the final test.,"[74180, 74252]",Gabriel Syme,"['The Policeman', 'The Invisible Chief']",Explicit,said Syme,[],[],[],X,194,major,TheManWhoWasThursday,296,296,4,4,9,74180,74252
Q195-0,"I do,","[74256, 74261]",The Invisible Chief,"['Gabriel Syme', 'The Policeman']",Anaphoric,said the other,[],[],[],X,195,minor,TheManWhoWasThursday,297,297,4,4,19,74256,74261
Q195-1,martyrs. I am condemning you to death. Good day.,"[74279, 74327]",The Invisible Chief,"['Gabriel Syme', 'The Policeman']",Anaphoric,said the other,['you'],"[[74304, 74307]]",[['Gabriel Syme']],X,195,minor,TheManWhoWasThursday,297,297,4,4,19,74279,74327
Q196-0,"If we walk up towards Leicester Square,","[81129, 81168]",The Secretary,['Gabriel Syme'],Anaphoric,he said,['we'],"[[81132, 81134]]","[['Gabriel Syme', 'The Secretary']]",X,196,minor,TheManWhoWasThursday,309,309,5,5,24,81129,81168
Q196-1,we shall just be in time for breakfast. Sunday always insists on an early breakfast. Have you had any sleep?,"[81180, 81288]",The Secretary,['Gabriel Syme'],Anaphoric,he said,"['we', 'you']","[[81180, 81182], [81270, 81273]]","[['Gabriel Syme', 'The Secretary'], ['Gabriel Syme']]",X,196,minor,TheManWhoWasThursday,309,309,5,5,24,81180,81288
Q197-0,"No,","[81292, 81295]",Gabriel Syme,['The Secretary'],Explicit,said Syme,[],[],[],X,197,major,TheManWhoWasThursday,310,310,5,5,9,81292,81295
Q198-0,"Nor have I,","[81310, 81321]",The Secretary,['Gabriel Syme'],Anaphoric,answered the man,[],[],[],X,198,minor,TheManWhoWasThursday,311,311,5,5,24,81310,81321
Q198-1,I shall try to get to bed after breakfast.,"[81362, 81404]",The Secretary,['Gabriel Syme'],Anaphoric,answered the man,[],[],[],X,198,minor,TheManWhoWasThursday,311,311,5,5,24,81362,81404
Q199-0,"Of course, the Secretary of the branch told you everything that can be told. But the one thing that can never be told is the last notion of the President, for his notions grow like a tropical forest. So in case you don't know, I'd better tell you that he is carrying out his notion of concealing ourselves by not concealing ourselves to the most extraordinary lengths just now. Originally, of course, we met in a cell underground, just as your branch does. Then Sunday made us take a private room at an ordinary restaurant. He said that if you didn't seem to be hiding nobody hunted you out. Well, he is the only man on earth, I know; but sometimes I really think that his huge brain is going a little mad in its old age. For now we flaunt ourselves before the public. We have our breakfast on a balcony on a balcony, if you please overlooking Leicester Square.","[81660, 82521]",The Secretary,['Gabriel Syme'],Implicit,,"['you', 'the President', 'his', 'you', 'you', 'he', 'his', 'we', 'your', 'Sunday', 'us', 'He', 'you', 'you', 'he', 'his', 'we', 'We', 'you']","[[81704, 81707], [81800, 81813], [81819, 81822], [81871, 81874], [81903, 81906], [81912, 81914], [81931, 81934], [82061, 82063], [82099, 82103], [82122, 82128], [82134, 82136], [82184, 82186], [82200, 82203], [82243, 82246], [82258, 82260], [82329, 82332], [82390, 82392], [82429, 82431], [82481, 82484]]","[['Gabriel Syme'], ['The President'], ['The President'], ['Gabriel Syme'], ['Gabriel Syme'], ['The President'], ['The President'], ['The Secretary', 'The President', 'Gogol'], ['Gabriel Syme'], ['The President'], ['The Secretary', 'The President', 'Gogol'], ['The President'], ['Gabriel Syme'], ['Gabriel Syme'], ['The President'], ['The President'], ['The Secretary', 'The President', 'Gogol'], ['The Secretary', 'The President', 'Gogol'], ['Gabriel Syme']]",X,199,minor,TheManWhoWasThursday,313,313,5,5,24,81660,82521
Q200-0,And what do the people say?,"[82525, 82552]",Gabriel Syme,['The Secretary'],Explicit,asked Syme,[],[],[],X,200,major,TheManWhoWasThursday,314,314,5,5,9,82525,82552
Q201-0,"It's quite simple what they say,","[82568, 82600]",The Secretary,['Gabriel Syme'],Anaphoric,answered his guide,[],[],[],X,201,minor,TheManWhoWasThursday,315,315,5,5,24,82568,82600
Q201-1,They say we are a lot of jolly gentlemen who pretend they are anarchists.,"[82623, 82696]",The Secretary,['Gabriel Syme'],Anaphoric,answered his guide,"['we', 'they']","[[82632, 82634], [82676, 82680]]","[['Gogol', 'The President', 'The Secretary'], ['Gogol', 'The President', 'The Secretary']]",X,201,minor,TheManWhoWasThursday,315,315,5,5,24,82623,82696
Q202-0,"It seems to me a very clever idea,","[82700, 82734]",Gabriel Syme,['The Secretary'],Explicit,said Syme,[],[],[],X,202,major,TheManWhoWasThursday,316,316,5,5,9,82700,82734
Q203-0,Clever! God blast your impudence! Clever!,"[82749, 82790]",The Secretary,['Gabriel Syme'],Anaphoric,cried out the other,['your'],"[[82767, 82771]]",[['Gabriel Syme']],X,203,minor,TheManWhoWasThursday,317,317,5,5,24,82749,82790
Q203-1,When you've seen Sunday for a split second you'll leave off calling him clever.,"[82899, 82978]",The Secretary,['Gabriel Syme'],Anaphoric,cried out the other,"[""you've"", 'Sunday', ""you'll"", 'him']","[[82904, 82910], [82916, 82922], [82942, 82948], [82967, 82970]]","[['Gabriel Syme'], ['The President'], ['Gabriel Syme'], ['The President']]",X,203,minor,TheManWhoWasThursday,317,317,5,5,24,82899,82978
Q204-0,"The gentlemen are up there, sare,","[86072, 86105]",The Waiter,"['Gabriel Syme', 'The Secretary']",Anaphoric,he said,['The gentlemen'],"[[86072, 86085]]","[['The President', 'Gogol']]",X,204,minor,TheManWhoWasThursday,322,322,5,5,25,86072,86105
Q204-1,They do talk and they do laugh at what they talk. They do say they will throw bombs at ze king.,"[86117, 86212]",The Waiter,"['Gabriel Syme', 'The Secretary']",Anaphoric,he said,"['They', 'they', 'they', 'They', 'they']","[[86117, 86121], [86134, 86138], [86156, 86160], [86167, 86171], [86179, 86183]]","[['The President', 'Gogol'], ['The President', 'Gogol'], ['The President', 'Gogol'], ['The President', 'Gogol'], ['The President', 'Gogol']]",X,204,minor,TheManWhoWasThursday,322,322,5,5,25,86117,86212
Q205-0,"Our friend Tuesday,","[89411, 89430]",The President,"['Professor De Worms', 'The Marquis', 'Gogol', 'The Secretary', 'Dr. Bull', 'Gabriel Syme']",Explicit,said the President,['Our friend Tuesday'],"[[89411, 89429]]",[['Gogol']],X,205,minor,TheManWhoWasThursday,330,330,5,5,19,89411,89430
